Id,Text,Text1,LanguageId,ConditionId,EmotesId,Flags,ChatBubbleDurationMs,SoundEntriesId0,SoundEntriesId1,EmoteId0,EmoteId1,EmoteId2,EmoteDelay0,EmoteDelay1,EmoteDelay2
"74656","Aggron! Show 'em who's boss!","","0","0","0","70","0","38451","0","0","0","0","0","0","0"
"74689","","Drek'Thar! I don't know what you are doing up there but it is angering the goren to no end.","0","0","0","71","0","0","41780","0","0","0","0","0","0"
"74738","","Be careful. This place is sacred, not safe. What I am about to do could get a lot of unwanted attention.","0","0","0","71","0","0","0","0","0","0","0","0","0"
"74739","","Great spirits of the wind, heed my call! Share with me the source of your pain.","0","0","0","71","0","0","0","0","0","0","0","0","0"
"74740","","I will try to use my totems to assist you if the need arises.","0","0","0","71","0","0","0","0","0","0","0","0","0"
"74741","I came to ask the elements for aid in the coming battle.","","0","0","0","71","0","46644","0","0","0","0","0","0","0"
"74742","But among the burning, biting winds of the mountains I heard the cry of the fury, Exurotus.","","0","0","0","71","0","46645","0","0","0","0","0","0","0"
"74743","Beaten, half consumed, and shattered by ancient magics, the fury is the prisoner of the magnaron Kron.","","0","0","0","71","0","46646","0","0","0","0","0","0","0"
"74744","The fury has been fragmented, its pieces scattered on the wind or consumed by scavengers.","","0","0","0","71","0","46647","0","0","0","0","0","0","0"
"74783","","Wait $p! This way. Before the giant sees you.","0","0","0","71","0","0","0","0","0","0","0","0","0"
"74784","Akama! Why not raze their town? Why give them another chance?","","0","0","5","69","0","0","0","0","0","0","0","0","0"
"74785","The word of an orc is garbage. They're only buying time.","","0","0","396","69","0","0","0","0","0","0","0","0","0"
"74786","Enough talk of battle, Hogo. Finally, Shadowmoon enjoys peace.","","0","0","274","69","0","0","0","0","0","0","0","0","0"
"74787","Or not.","","0","0","6","69","0","0","0","0","0","0","0","0","0"
"74788","MY EARS HURT!","","0","0","5","69","0","0","0","0","0","0","0","0","0"
"74828","","I hear a spirit. A powerful one! Keep those goren at bay for just a little longer.","0","22207","0","71","0","0","0","0","0","0","0","0","0"
"74829","","Buy me just a few more moments.","0","22207","0","71","0","0","0","0","0","0","0","0","0"
"74842","","Stay down, shaman. Catch your breath. This champion can forge ahead and we will catch up when you are ready.","0","0","0","71","0","0","41783","0","0","0","0","0","0"
"74907","","Spirits of the wind, lend us your speed.","0","0","0","71","0","0","0","0","0","0","0","0","0"
"74908","","The Thunderlord are fools for the most part, but they understand combat with giants.","0","0","0","71","0","0","0","0","0","0","0","0","0"
"74909","","They are also notorious for etching down their favorite tactics on armbands. I assume they are either bragging or failing to remember.","0","0","0","71","0","0","0","0","0","0","0","0","0"
"74910","","Spirits save me but it is cold. My lungs feel like they are on fire.","0","0","0","71","0","0","0","0","0","0","0","0","0"
"74911","","There it is. The carcass. I... I don't think I can go with you in there. My arm will not stop shaking and it is as if the land itself is screaming in my mind.","0","0","0","71","0","0","0","0","0","0","0","0","0"
"74931","","I will see you on the inside, $p. Spirits guide you. Orgrock, lend me a hand if you will.","0","0","0","71","0","0","0","0","0","0","0","0","0"
"75008","","In here.","7","0","0","68","0","0","44119","0","0","0","0","0","0"
"75014","Our work is vital to the world.","","0","0","0","71","0","41913","0","0","0","0","0","0","0"
"75045","Here! My champion arrives!","","0","16604","0","71","0","38370","0","0","0","0","0","0","0"
"75046","Ah, of course! My old friend from the Jade Forest!","","0","16604","0","71","0","38107","0","0","0","0","0","0","0"
"75047","Wait wait wait - let me make sure I get the story right.","","0","0","0","71","0","38108","0","0","0","0","0","0","0"
"75050","Pandaren will tell this tale for generations!","","0","0","0","71","0","38109","0","0","0","0","0","0","0"
"75052","It starts with a hero.","","0","0","0","71","0","38371","0","0","0","0","0","0","0"
"75054","An outsider, from beyond the mists!","","0","0","0","71","0","38110","0","0","0","0","0","0","0"
"75056","Conquering a strange new land!","","0","0","0","71","0","38372","0","0","0","0","0","0","0"
"75058","Must we use the word, ""Conquer?""","","0","0","0","71","0","38111","0","0","0","0","0","0","0"
"75059","Venturing into forgotten vaults...","","0","0","0","71","0","38373","0","0","0","0","0","0","0"
"75061","Mantid and mogu alike were brought low by the hero's fury.","","0","0","0","71","0","38112","0","0","0","0","0","0","0"
"75064","Their power and wisdom seized for a greater glory!","","0","0","0","71","0","38374","0","0","0","0","0","0","0"
"75066","When war came to Pandaria's shores, our hero was ready.","","0","0","0","71","0","38113","0","0","0","0","0","0","0"
"75067","A faction standard-bearer, beloved by the people and feared by their foes.","","0","0","0","71","0","38375","0","0","0","0","0","0","0"
"75068","Even the mighty Thunder King fell before our champion's might.","","0","0","0","71","0","38114","0","0","0","0","0","0","0"
"75069","One by one the secrets of an ancient empire were laid bare.","","0","0","0","71","0","38376","0","0","0","0","0","0","0"
"75070","Yes, knowledge uncovered for the benefit of the world.","","0","0","0","71","0","38115","0","0","0","0","0","0","0"
"75071","POWER acquired for WAR and CONQUEST!","","0","0","0","71","0","38377","0","0","0","0","0","0","0"
"75074","Let us stop for a moment - what kind of hero are we talking about?","","0","0","0","71","0","38116","0","0","0","0","0","0","0"
"75078","An agent of destruction, forged by my will to forever change the face of Azeroth.","","0","0","0","71","0","38378","0","0","0","0","0","0","0"
"75083","My friend, please think carefully about the legacy you will leave behind.","","0","0","0","71","0","38117","0","0","0","0","0","0","0"
"75085","Behold! Latent titan power, imbued with my own draconic essence, tempered by the wisdom of the pandaren celestials.","","0","0","0","71","0","38379","0","0","0","0","0","0","0"
"75089","Overwhleming power. Use it to heal or destroy! To protect or annihilate!","","0","0","0","71","0","38380","0","0","0","0","0","0","0"
"75093","Come to me, champion! Collect your well-earned reward!","","0","0","0","71","0","38381","0","0","0","0","0","0","0"
"75105","How will the story end?","","0","0","0","71","0","38118","0","0","0","0","0","0","0"
"75111","There is only one way to find out.","","0","0","0","71","0","38382","0","0","0","0","0","0","0"
"75115","A pandaren legend is born! Sing praises to our new hero, $n!","","0","22592","0","71","0","38119","0","0","0","0","0","0","0"
"75148","Nonsense. I had that handled. Cool as a cucumber.","","0","0","0","68","0","45001","0","0","0","0","0","0","0"
"75150","","I knew it. You should've stayed back at the garrison, Archmage.","0","0","0","68","0","0","44127","0","0","0","0","0","0"
"75320","Tell my story...","Tell my story...","0","0","0","71","0","0","0","0","0","0","0","0","0"
"75351","I will crush it! (The Pale are the key.)","","0","0","0","70","0","46624","0","0","0","0","0","0","0"
"75374","Unlike you, your minions are adorable.","","0","0","0","64","0","0","0","0","0","0","0","0","0"
"75375","I have been programmed to gloat.  Ha ha.  Ha ha.  Ha ha.","","0","0","11","64","0","0","0","0","0","0","0","0","0"
"75376","This is unfortunate.","","0","0","0","64","0","0","0","0","0","0","0","0","0"
"75378","How does that feel, $r?","","0","0","0","64","0","0","0","0","0","0","0","0","0"
"75379","If I had emotions, I still wouldn't feel sad about that.","","0","0","0","64","0","0","0","0","0","0","0","0","0"
"75395","Your minion has been terminated.","","0","0","0","64","0","0","0","0","0","0","0","0","0"
"75396","My olfactory sensors detect a burning odor.","","0","0","0","64","0","0","0","0","0","0","0","0","0"
"75397","Too bad.  Now for a real pet.","","0","0","0","64","0","0","0","0","0","0","0","0","0"
"75398","You'll pay for that.","","0","0","0","64","0","0","0","0","0","0","0","0","0"
"75502","An opportunity presents itself! I believe the Timeless Isle holds the key to unlocking the full potential of your cloak.","","0","0","0","69","0","38383","0","0","0","0","0","0","0"
"75503","An island, lost in time, where the sun never sets. What could it mean?","","0","0","0","69","0","0","0","0","0","0","0","0","0"
"75504","Power! Glory! Loot!","","0","0","0","69","0","38384","0","0","0","0","0","0","0"
"75505","...Ours for the taking! Hero, meet me at the Timeless Isle.","","0","0","0","69","0","38385","0","0","0","0","0","0","0"
"75507","I should very much like to see this island for myself. Perhaps I will see you there?","","0","0","0","69","0","0","0","0","0","0","0","0","0"
"75595","","|cFFFF8040Ki the Assassin |r|cFF71D5FF|Hspell:145427|h[Kick]|h|r|cFFFF8040s the $n.|r","0","0","0","69","0","0","0","0","0","0","0","0","0"
"75596","","|cFFFF8040Kavan the Arcanist |r|cFF71D5FF|Hspell:145530|h[Counterspell]|h|r|cFFFF8040s the $n.|r","0","0","0","69","0","0","0","0","0","0","0","0","0"
"75629","You are what you drink, $n -- I hope you have been drinking something strong.","","0","0","0","65","0","0","0","0","0","0","0","0","0"
"75630","You fought well, but your tactics are all wrong.  Have a drink and and rethink them.","","0","0","0","65","0","0","0","0","0","0","0","0","0"
"75631","Look at this, I have been beaten!  I'm going to have to brew up some ideas for next time.","","0","0","0","65","0","0","0","0","0","0","0","0","0"
"75632","Why did he fight?  To die, apparently.","","0","0","0","65","0","0","0","0","0","0","0","0","0"
"75633","The wind blows in my favor.","","0","0","0","65","0","0","0","0","0","0","0","0","0"
"75634","A fortunate attack!","","0","0","0","65","0","0","0","0","0","0","0","0","0"
"75635","I knew that was coming.","","0","0","0","65","0","0","0","0","0","0","0","0","0"
"75636","Such a glorious defeat!","","0","0","0","65","0","0","0","0","0","0","0","0","0"
"75637","Rest for now, little friend.","","0","0","0","69","0","0","0","0","0","0","0","0","0"
"75638","Maybe, uh, maybe you're ready for a lesson in chaos?","","0","0","0","65","0","0","0","1","0","0","0","0","0"
"75639","You were so preoccupied with whether or not you could win, you didn't stop to think if you should.","","0","0","0","64","0","0","0","1","0","0","0","0","0"
"75640","Gee, the lack of humility before nature that's being displayed here, uh... staggers me.","","0","0","0","64","0","0","0","1","0","0","0","0","0"
"75641","What's so great about victory? It's a violent, penetrative act that scars what it explores. What you call victory... well, nevermind.","","0","0","0","64","0","0","0","1","0","0","0","0","0"
"75642","Dead?  Don't you mean extinct?","","0","0","0","64","0","0","0","1","0","0","0","0","0"
"75643","Your pet had its shot, and nature selected it for extinction.","","0","0","0","64","0","0","0","1","0","0","0","0","0"
"75644","I'm, I'm simply saying that life, uh... didn't find a way.","","0","0","0","64","0","0","0","1","0","0","0","0","0"
"75645","That's, that's chaos theory.","","0","0","0","64","0","0","0","1","0","0","0","0","0"
"75646","What have you got on that team of yours, King Mukla?","","0","0","0","64","0","0","0","1","0","0","0","0","0"
"75647","Dinos... dropping?  Dropping?","","0","0","0","64","0","0","0","1","0","0","0","0","0"
"75648","You now face Patience!  Wisdom!  Knowledge!  What virtues do you possess, $n?","","0","0","0","65","0","0","0","0","0","0","0","0","0"
"75649","Today you have lost -- but what have you learned?","","0","0","0","65","0","0","0","0","0","0","0","0","0"
"75650","You have taught me much, $r.  It seems the master has again become the student.","","0","0","0","65","0","0","0","0","0","0","0","0","0"
"75651","A worthy sacrifice.","","0","0","0","65","0","0","0","0","0","0","0","0","0"
"75652","The autumn leaves must fall to make room for spring blossoms.","","0","0","0","65","0","0","0","0","0","0","0","0","0"
"75653","Defeat is merely a lesson masked by disappointment.","","0","0","0","65","0","0","0","0","0","0","0","0","0"
"75654","Like the stream meeting the cliff, there is beauty in the fall, if you know where to look.","","0","0","0","65","0","0","0","0","0","0","0","0","0"
"75655","To die would be a wonderfully grand adventure.","","0","0","0","65","0","0","0","0","0","0","0","0","0"
"75656","When one virtue is lost, cling to those that remain.","","0","0","0","65","0","0","0","0","0","0","0","0","0"
"75657","A worthy sacrifice?","","0","0","0","65","0","0","0","0","0","0","0","0","0"
"75658","","Oh, I hope you like surprises.","0","0","0","64","0","0","0","0","0","0","0","0","0"
"75659","","You're lucky it was just your pets... this time.","0","0","0","64","0","0","0","0","0","0","0","0","0"
"75660","","In the Celestial Tournament, either you win or you die.","0","0","0","64","0","0","0","0","0","0","0","0","0"
"75661","","Take the right opponent out and it's all downhill from there.","0","0","0","64","0","0","0","0","0","0","0","0","0"
"75662","","Oh, was that one of your favorites?  My bad.","0","0","0","64","0","0","0","0","0","0","0","0","0"
"75663","","This is so easy it would be boring -- if it weren't so much fun.","0","0","0","64","0","0","0","0","0","0","0","0","0"
"75664","","You bastard, my pet may never walk again!","0","0","0","64","0","0","0","0","0","0","0","0","0"
"75665","","The things we love destroy us every time, $c, remember that.","0","0","0","64","0","0","0","0","0","0","0","0","0"
"75666","","Keep killing my pets and you may find a dash of poison in your drink tonight.","0","0","0","64","0","0","0","0","0","0","0","0","0"
"75667","","Fear cuts deeper than swords.","0","0","0","64","0","0","0","0","0","0","0","0","0"
"75668","Yer lucky Gizmo couldn't be here, but I'll still wipe the floor with ye, $c.","","0","0","0","65","0","0","0","0","0","0","0","0","0"
"75669","That one's for you, Gizmo!","","0","0","0","65","0","0","0","0","0","0","0","0","0"
"75670","Ach, so much for being good with animals. Now how do these bandages work?","","0","0","0","65","0","0","0","0","0","0","0","0","0"
"75671","Ha!  That worked better than I thought!","","0","0","0","65","0","0","0","0","0","0","0","0","0"
"75672","Oh, sorry, that fella's gunna need some tender lovin' later.","","0","0","0","65","0","0","0","0","0","0","0","0","0"
"75673","Fer a moment there, I thought we were in trouble.","","0","0","0","65","0","0","0","0","0","0","0","0","0"
"75674","No! Not again!","","0","0","0","65","0","0","0","0","0","0","0","0","0"
"75675","Curse my dwarven luck!","","0","0","0","65","0","0","0","0","0","0","0","0","0"
"75676","Oi, you'll pay for that one you will!","","0","0","0","65","0","0","0","0","0","0","0","0","0"
"75677","Do not be fooled by their diminutive size, $n, they are disciplined and quick.","","0","0","0","65","0","0","0","0","0","0","0","0","0"
"75678","Impatience is the road to defeat, you must learn to master your timing.","","0","0","0","65","0","0","0","0","0","0","0","0","0"
"75679","It requires a cunning strategist indeed to defeat my monks.  Well done, $n.","","0","0","0","65","0","0","0","0","0","0","0","0","0"
"75680","Exactly as I had planned.","","0","0","0","65","0","0","0","0","0","0","0","0","0"
"75681","You lack the necessary discipline.","","0","0","0","65","0","0","0","0","0","0","0","0","0"
"75682","Can you survive with what remains?","","0","0","0","65","0","0","0","0","0","0","0","0","0"
"75683","He fought and died with honor.","","0","0","0","65","0","0","0","0","0","0","0","0","0"
"75684","Victory often requires sacrifice.","","0","0","0","65","0","0","0","0","0","0","0","0","0"
"75685","When one Shado-Pan falls, another steps forward to take his place.","","0","0","0","65","0","0","0","0","0","0","0","0","0"
"75686","As water cracks stone, so shall we be your undoing.","","0","0","0","65","0","0","0","0","0","0","0","0","0"
"75687","The rivers foretold of this triumph.","","0","0","0","65","0","0","0","0","0","0","0","0","0"
"75688","The rivers foretold of this defeat.","","0","0","0","65","0","0","0","0","0","0","0","0","0"
"75689","And so they are washed away with little trace of what once was.","","0","0","0","65","0","0","0","0","0","0","0","0","0"
"75690","The stone thinks itself unmovable until the ground is washed away beneath it.","","0","0","0","65","0","0","0","0","0","0","0","0","0"
"75691","Cleansed by the righteous waters!","","0","0","0","65","0","0","0","0","0","0","0","0","0"
"75692","My companion is dispersed.  She will flow back to me when the time is right.","","0","0","0","65","0","0","0","0","0","0","0","0","0"
"75693","The river does not stop from a single stone.","","0","0","0","65","0","0","0","0","0","0","0","0","0"
"75694","The ebbs and flows of battle are to be expected.","","0","0","0","65","0","0","0","0","0","0","0","0","0"
"75696","Dragons are dangerous at any size, as I'm sure you'll find out.","","0","0","0","65","0","0","0","0","0","0","0","0","0"
"75697","If I can win a battle like that, I may have a chance against the Celestials.","","0","0","0","65","0","0","0","0","0","0","0","0","0"
"75698","Well done, $n.  You picked your friends wisely and led them with honor.","","0","0","0","65","0","0","0","0","0","0","0","0","0"
"75699","As I warned you before, dragons are known for their deadly attacks.","","0","0","0","65","0","0","0","0","0","0","0","0","0"
"75700","Even the strongest ally can fall to draconic magic.","","0","0","0","65","0","0","0","0","0","0","0","0","0"
"75701","A glass cannon sometimes breaks before it can fire.","","0","0","0","65","0","0","0","0","0","0","0","0","0"
"75702","You have strength I didn't see at first.","","0","0","0","65","0","0","0","0","0","0","0","0","0"
"75703","An unexpected move.","","0","0","0","65","0","0","0","0","0","0","0","0","0"
"75704","It will be difficult to recover from such a loss.","","0","0","0","65","0","0","0","0","0","0","0","0","0"
"75706","Do not despair the damage that was done here.","","0","0","0","71","0","39079","0","0","0","0","0","0","0"
"75707","A long time ago, this land was beset by the shadows of doubt, of fear, and hatred.","","0","0","0","71","0","0","0","0","0","0","0","0","0"
"75708","One by one, I overcame them - and buried them deep within the earth.","","0","0","0","71","0","0","0","0","0","0","0","0","0"
"75709","And there ... they remained.","","0","0","0","71","0","0","0","0","0","0","0","0","0"
"75710","For ten thousand years ... as the veil of mists kept Pandaria hidden from prying eyes.","","0","0","0","71","0","0","0","0","0","0","0","0","0"
"75711","When the Cataclysm struck, I decided the time had come to part the mists ... and help heal our broken world.","","0","0","0","71","0","0","0","0","0","0","0","0","0"
"75712","But as your war-fleets crashed upon our shores, all of my old doubts and fears rose up, to torment the land once again.","","0","0","0","71","0","0","0","0","0","0","0","0","0"
"75713","You triumphed over the darkness I had locked away.","","0","0","0","71","0","39080","0","0","0","0","0","0","0"
"75714","You have shown Pandaria the power of a true hero.","","0","0","0","71","0","39081","0","0","0","0","0","0","0"
"75715","But the question still remains... why do we fight?","","0","0","0","71","0","39082","0","0","0","0","0","0","0"
"75716","Face your fears. Calm your hatreds.","","0","0","0","71","0","39084","0","0","0","0","0","0","0"
"75717","Find peace within yourself, so that you may share it with the world around you.","","0","0","0","71","0","39085","0","0","0","0","0","0","0"
"75718","These are the greatest treasures in life.","","0","0","0","71","0","39086","0","0","0","0","0","0","0"
"75719","Surely they... are worth fighting for.","","0","0","0","71","0","39087","0","0","0","0","0","0","0"
"75726","I have been apprising the lorewalker of your deeds, champion. Are you ready to hear your tale?","","0","0","0","71","0","0","0","0","0","0","0","0","0"
"75772","Dear Emperor. It is done. The darkness that you once struggled against has been purged from Pandaria - forever.","","0","0","0","71","0","39076","0","0","0","0","0","0","0"
"75773","But the cost... such a terrible cost.","","0","0","0","71","0","39077","0","0","0","0","0","0","0"
"75776","These outsiders have brought chaos to this land. Can we trust them to set it right?","","0","0","0","71","0","38754","0","0","0","0","0","0","0"
"75791","","Gul'dan sends his best.","0","0","0","68","0","0","44460","0","0","0","0","0","0"
"75797","I trust you have learned: To fight out of fear or anger is to fight a war that never ends.","","0","0","0","71","0","39083","0","0","0","0","0","0","0"
"75813","Hehehehahahaha!","","0","0","0","70","0","38461","0","0","0","0","0","0","0"
"75814","Alright, boys. Let's show 'em how Blackfuse Company fights.","","0","0","0","70","0","38462","0","0","0","0","0","0","0"
"75821","BEHOLD, MY GLORIOUS DESTINY!","","0","0","0","71","0","38058","0","0","0","0","0","0","0"
"75872","","Sorry, vanishing!","0","0","0","69","0","0","38580","0","0","0","0","0","0"
"75873","","I am sure they are trying, Kavan. Be nice.","0","0","0","69","0","0","38581","0","0","0","0","0","0"
"75874","","Sooli, move!","0","0","0","69","0","0","38582","0","0","0","0","0","0"
"75875","","Ah, our first enemy! Illusionary Rippers are but simple warriors. Now, let us do this!","0","0","0","69","0","0","38584","0","0","0","0","0","0"
"75876","","Illusionary Flamecallers! Watch your feet, everyone. Do not stand in the lava.","0","0","0","69","0","0","38585","0","0","0","0","0","0"
"75877","","I am down. Let us try again!","0","0","0","69","0","0","38586","0","0","0","0","0","0"
"75878","","Oh no, did you forget to heal yourself?","0","0","0","69","0","0","38587","0","0","0","0","0","0"
"75879","","The illusions will not hold back, this time. Their attacks will be relentless. Be prepared to use your strongest healing spells.","0","0","0","69","0","0","38588","0","0","0","0","0","0"
"75880","Oh dear. Speedy, help!","","0","0","0","69","0","38964","0","0","0","0","0","0","0"
"75881","Huh? Ohhhh, ohhh!","","0","0","0","69","0","38965","0","0","0","0","0","0","0"
"75882","Ahh, Illusionary Tunnelers! Speedy and I have faced these foes before. Beware, they may burrow into the ground and then suddenly pop up under a new target, and CHOMP! Hah ha hah ha.","","0","0","0","69","0","38967","0","0","0","0","0","0","0"
"75883","Argh... please... take care... of Speedy!","","0","0","0","69","0","38968","0","0","0","0","0","0","0"
"75884","There is no end in sight to these illusions, but we shall hold out as long as we can.","","0","0","0","69","0","38969","0","0","0","0","0","0","0"
"75885","Hah ha! Wonderful job, everyone! Friend, see Rotun about beginning the next trial.","","0","0","0","69","0","38970","0","0","0","0","0","0","0"
"75933","Long ago, the Jade Serpent instructed me to purify my spirit and become one with the land, my doubts were vanquished.","","0","0","0","71","0","38036","0","0","0","0","0","0","0"
"75934","When my journey began, I was reckless in my strength. The White Tiger taught me control. My hatred, anger, and violence were vanquished.","","0","0","0","71","0","38037","0","0","0","0","0","0","0"
"75935","The Red Crane saw hope in me, and instructed me to look inward. Despite my visage of despair, I found this hope, and the despair was vanquished.","","0","0","0","71","0","38038","0","0","0","0","0","0","0"
"75936","In the face of great fear, the Black Ox taught me fortitude. Through terror and darkness it persevered. The fear was vanquished.","","0","0","0","71","0","38039","0","0","0","0","0","0","0"
"75937","You have walked the trial of wisdom, and learned of the path of the Jade Serpent. May you learn from this lesson, as I did.","","0","0","0","71","0","38040","0","0","0","0","0","0","0"
"75938","You have walked the trial of strength, and learned of the path of the White Tiger. May you remember this lesson, always.","","0","0","0","71","0","38041","0","0","0","0","0","0","0"
"75939","You have walked the trial of hope, and learned of the path of the Red Crane. May it guide your footsteps through time.","","0","0","0","71","0","38042","0","0","0","0","0","0","0"
"75940","You have walked the trial of fortitude, and learned of the path of the Black Ox. May it bless your passage.","","0","0","0","71","0","38043","0","0","0","0","0","0","0"
"75956","","Help! Get these things off of me!","0","0","0","69","0","0","38426","0","0","0","0","0","0"
"75957","","What are you standing in?! Get out of the fire!","0","0","0","69","0","0","38427","0","0","0","0","0","0"
"75958","","Illusionary Rippers approaching. They should pose little challenge; they are but mindless grunts.","0","0","0","69","0","0","38428","0","0","0","0","0","0"
"75959","","Prepare your defenses. That is an Illusionary Conqueror! When they become enraged, they gain great strength, and nothing can stop them.","0","0","0","69","0","0","38429","0","0","0","0","0","0"
"75960","","A new enemy, Illusionary Flamecallers. They cast fireballs and spew lava. Use the lava to your advantage; it will burn the other illusions.","0","0","0","69","0","0","38430","0","0","0","0","0","0"
"75961","","Beware! Illusionary Wind-Guards can use their wings to knock you back. When they do, they will likely switch to attacking me instead.","0","0","0","69","0","0","38431","0","0","0","0","0","0"
"75962","","Illusionary Ambushers! Get their attention, quick. And get them away from me, so they cannot hit me with their devastating bananas!","0","0","0","69","0","0","38432","0","0","0","0","0","0"
