Id,Text,Text1,LanguageId,ConditionId,EmotesId,Flags,ChatBubbleDurationMs,SoundEntriesId0,SoundEntriesId1,EmoteId0,EmoteId1,EmoteId2,EmoteDelay0,EmoteDelay1,EmoteDelay2
"154402","Out of the way! Bringin' in the big guns!","","0","0","0","70","0","105733","0","0","0","0","0","0","0"
"154408","Time to earn our pay. Fire at will!","","0","0","0","70","0","105734","0","0","0","0","0","0","0"
"154411","","Fools! G'huun not gonna fail! Ya power be useless!","0","0","0","70","0","0","105672","0","0","0","0","0","0"
"154700","Oh! Curveball! Curveball!","","0","0","0","68","0","105781","0","0","0","0","0","0","0"
"154701","","Curveball! Curveball!","0","0","0","68","0","0","104596","0","0","0","0","0","0"
"154769","","Princess Talanji was kind enough to inform us of an old portal network we might be able to tap into.","0","0","0","68","0","0","106331","0","0","0","0","0","0"
"154772","","Oculeth, see what you can do with the portal system here. We will need supply lines to the Horde capitals.","0","0","0","68","0","0","106332","0","0","0","0","0","0"
"154774","","Champion, you seem to be on the right track for gaining the trust of the Zandalari. I must attend to my other duties. Good luck.","0","0","0","68","0","0","106333","0","0","0","0","0","0"
"154801","...","","0","0","0","86","0","0","0","0","0","0","0","0","0"
"154805","...","","0","0","0","86","0","0","0","0","0","0","0","0","0"
"154809","...","","0","0","0","86","0","0","0","0","0","0","0","0","0"
"154810","...","","0","0","0","86","0","0","0","0","0","0","0","0","0"
"154811","...","","0","0","0","86","0","0","0","0","0","0","0","0","0"
"154812","...","","0","0","0","86","0","0","0","0","0","0","0","0","0"
"154813","...","","0","0","0","86","0","0","0","0","0","0","0","0","0"
"154814","...","","0","0","0","86","0","0","0","0","0","0","0","0","0"
"154815","...","","0","0","0","86","0","0","0","0","0","0","0","0","0"
"154816","...","","0","0","0","86","0","0","0","0","0","0","0","0","0"
"154940","","How tenacious! Feel honor in your accomplishment of living long enough to face my pride.","0","0","1","70","8960","0","107011","0","0","0","0","0","0"
"154944","Alliance... hold!","","0","0","0","70","1148","109191","0","0","0","0","0","0","0"
"154945","No! I demand an honorable death!","","0","0","0","70","6269","106268","0","0","0","0","0","0","0"
"154946","My father once said that Varok Saurfang embodied the honor of the Horde...","","0","0","0","70","5822","109192","0","0","0","0","0","0","0"
"154947","Listen to me. There is no honor in this.","","0","0","0","70","4801","109193","0","0","0","0","0","0","0"
"154948","That is not for an Alliance king to decide!","","0","0","0","70","4235","106269","0","0","0","0","0","0","0"
"154949","At this moment, it is.","","0","0","0","70","2235","109194","0","0","0","0","0","0","0"
"154951","Take him to the Stockades.","","0","0","0","70","0","109195","0","0","0","0","0","0","0"
"154952","When I return, we will speak of honor... and how it may yet be reclaimed.","","0","0","0","70","5040","109196","0","0","0","0","0","0","0"
"154953","If... you return.","","0","0","0","70","2584","106270","0","0","0","0","0","0","0"
"155422","...","","0","0","0","86","0","0","0","0","0","0","0","0","0"
"155644","","Are those gunpowder shipments in from the Ashvane Foundry?","0","0","0","68","0","0","0","0","0","0","0","0","0"
"155645","Y-yes, Captain Stone.","Y-yes, Captain Stone.","0","0","0","68","0","0","0","0","0","0","0","0","0"
"155646","","Well, load them onto the ship! Those explosives are a safety hazard.","0","0","0","68","0","0","0","0","0","0","0","0","0"
"155647","Of course, Captain.","Of course, Captain.","0","0","0","68","0","0","0","0","0","0","0","0","0"
"155648","Almost dere. Dis is de island dat our scouts say holds a lot of Azerite.","","0","0","0","70","0","108533","0","0","0","0","0","0","0"
"155649","We do not know what else is here, though. You have to watch your backs out dere.","","0","0","0","70","0","108534","0","0","0","0","0","0","0"
"155650","Lower de gangplanks. Dis is de place.","","0","0","0","70","0","108535","0","0","0","0","0","0","0"
"155663","","Careful there, John. That gunpowder'll blow your hand clean off.","0","0","0","68","0","0","0","0","0","0","0","0","0"
"155664","What? This is a BOMB? I thought it was an avocado.","","0","0","0","68","0","0","0","0","0","0","0","0","0"
"155665","Sure am glad we got assigned out here today.","Sure am glad we got assigned out here today.","0","0","0","68","0","0","0","0","0","0","0","0","0"
"155666","Captain Stone's really worked up about something.","Captain Stone's really worked up about something.","0","0","0","68","0","0","0","0","0","0","0","0","0"
"155667","I heard it has something to do with all those crates we've been getting from the Ashvane.","I heard it has something to do with all those crates we've been getting from the Ashvane.","0","0","0","68","0","0","0","0","0","0","0","0","0"
"155668","","That's far enough.","0","0","0","70","0","0","107784","0","0","0","0","0","0"
"155669","","Mother? Is that... you?","0","0","0","70","0","0","107785","0","0","0","0","0","0"
"155670","","I'm so glad you could join us my dear. Your father has missed you so.","0","0","0","70","0","0","107786","0","0","0","0","0","0"
"155671","","What... What have you done to him?!","0","0","0","70","0","0","107787","0","0","0","0","0","0"
"155672","","Be appreciative, girl! Not only is your father alive and well, but he will soon be lord of all Kul Tiras! Come join us, child...","0","0","0","70","0","0","107788","0","0","0","0","0","0"
"155673","Keep away from her, you heartless witch!","","0","0","0","70","0","107792","0","0","0","0","0","0","0"
"155675","","Why Marshal, that's no way to talk to a Lady. I should teach you some manners.","0","0","0","70","0","0","107789","0","0","0","0","0","0"
"155677","","Now, Marshal, be a dear and bring Lucille to my quarters, after you dispose of these pests...","0","0","0","70","0","0","107790","0","0","0","0","0","0"
"155678","","Come, Arthur.","0","0","0","70","0","0","107791","0","0","0","0","0","0"
"155680","As you wish, Mother...","","0","0","0","70","0","107793","0","0","0","0","0","0","0"
"155812","Pretty sure this is the place. Supposed to be a lot of Azerite around here.","","0","0","0","70","0","108839","0","0","0","0","0","0","0"
"155813","You know, there could also be, like, giant spiders here, too. I'm just saying, you never know.","","0","0","0","70","0","108840","0","0","0","0","0","0","0"
"155814","Bring her in, try not to hit anything. And get the gangplanks down, thanks.","","0","0","0","70","0","108841","0","0","0","0","0","0","0"
"155867","Invaders in the Foundry! I repeat, INVA-","Invaders in the Foundry! I repeat, INVA-","0","0","0","68","0","0","0","0","0","0","0","0","0"
"156167","","Head into town and round up as many guards as you can!","0","0","0","68","0","0","0","0","0","0","0","0","0"
"156173","","For the Horde!","0","0","0","68","0","0","0","0","0","0","0","0","0"
"156182","","If what dis exile says is true, den you must investigate. But use caution. Jakra'zet may still be near.","0","0","1","68","0","0","109046","0","0","0","0","0","0"
"156232","","The mountain gives us life. Grants us strength.","0","0","0","70","4045","0","109894","0","0","0","0","0","0"
"156233","","Upon hammer and anvil, our kingdom was forged. With hearts o' fire... and wills o' iron.","0","0","0","70","8152","0","109895","0","0","0","0","0","0"
"156234","","The same blood that flows through our veins... flows through Azeroth's as well.","0","0","0","70","6671","0","109896","0","0","0","0","0","0"
"156235","","This world must be defended. Forward, Dark Irons! Tae battle we march!","0","0","0","70","9395","0","109897","0","0","0","0","0","0"
"156342","","The town we passed by, Bridgeport, seems to be the largest threat in the area.","0","0","0","68","0","0","0","0","0","0","0","0","0"
"156353","","We need to show the Kul Tirans what it means to make an enemy of the Horde.","0","0","0","68","0","0","0","0","0","0","0","0","0"
"156556","","Come, hero. Let me show you around.","0","0","0","68","0","0","112312","0","0","0","0","0","0"
"156557","","It is said de Great Seal is one of de only things still standing dat is older than de Zandalari Empire.","0","0","0","68","0","0","112313","0","0","0","0","0","0"
"156558","","My father keeps many of his treasures here in de royal vault.","0","0","0","68","0","0","112314","0","0","0","0","0","0"
"156559","","You can find your nightborne friend in de Hall of Ancient Paths. Come see me when you are done looking around.","0","0","0","68","0","0","112315","0","0","0","0","0","0"
"156607","But do you have time to waste?","","0","0","6","70","0","110252","0","0","0","0","0","0","0"
"156608","","This isn't over!","0","0","274","70","0","0","110253","0","0","0","0","0","0"
"156724","","Zelling! Damn you, we need you alive!","0","0","5","68","0","0","0","0","0","0","0","0","0"
"156725","<wheeze> I'm... sorry. I.. can't... I don't have anything... left in me...","","0","0","0","68","0","0","0","0","0","0","0","0","0"
"156728","Miss Voss, <cough> please... bring me back... I must help my family... I'll do anything... anything...","","0","0","0","68","0","0","0","0","0","0","0","0","0"
"156729","","You'll be shunned if you become one of us. You look in a mirror and all you'll see is a monster.","0","0","1","68","0","0","0","0","0","0","0","0","0"
"156732","","We'll see. Maybe it can be different... just this one time.","0","0","274","68","0","0","0","0","0","0","0","0","0"
"156830","","Lilian Voss. Why have you called upon me?","0","0","0","68","0","0","0","0","0","0","0","0","0"
"156831","Lilian. We can find other tidesages. You know his family won't accept him.","","0","0","1","68","0","0","0","0","0","0","0","0","0"
"156832","","Bring this man back. He has been chosen to become Forsaken.","0","0","0","68","0","0","0","0","0","0","0","0","0"
"156833","","As you command, by the will of the Dark Lady.","0","0","1","68","0","0","0","0","0","0","0","0","0"
"156936","Infuse this amulet with power... it might be the only way tae save her!","","0","0","0","70","0","111031","0","0","0","0","0","0","0"
"156980","Finally, a challenger steps up!","","0","0","0","64","0","0","0","0","0","0","0","0","0"
"156981","How is this possible?!","","0","0","0","64","0","0","0","0","0","0","0","0","0"
"156982","This will not stand! You have not seen the last of Captain Hermes and his trio of ruthless crabs!","","0","0","0","64","0","0","0","0","0","0","0","0","0"
"156983","Looks like you need to seek some shell-ter. Get it? Shells? Crabs! Victory is mine!","","0","0","0","64","0","0","0","0","0","0","0","0","0"
"156984","Yeah! Crustacean power!","","0","0","0","64","0","0","0","0","0","0","0","0","0"
"157091","Brothers and sisters, behold our glorious destiny!","","0","0","0","70","0","111091","0","0","0","0","0","0","0"
"157150","I would... damn my soul... for all eternity... if it meant my family's happiness... please! You must...","","0","0","0","68","0","0","0","0","0","0","0","0","0"
"157151","You... must...","","0","0","0","68","0","0","0","0","0","0","0","0","0"
"157228","I... I live! Hahaha! I must see Julia and the children at once. They will be delighted!","","0","0","0","68","0","0","0","0","0","0","0","0","0"
"157229","","I guess we'll see what happens now.","0","0","274","68","0","0","0","0","0","0","0","0","0"
"157593","","The rumors are true. Daelin's Gate... has fallen.","0","0","1","70","5274","0","112092","0","0","0","0","0","0"
"157597","","A pirate fleet struck the gate with overwhelming force...","0","0","1","70","4176","0","112093","0","0","0","0","0","0"
"157598","Pirates?! The Proudmoores can't even protect us from pirates anymore!","","0","0","1","70","5582","111455","0","0","0","0","0","0","0"
"157600","","For shame!","0","0","1","70","1141","0","111406","0","0","0","0","0","0"
"157603","","But it has not been enough.","0","0","1","70","1713","0","112094","0","0","0","0","0","0"
"157605","","Lady Ashvane has been my rock since those first dark days when we both lost our husbands. Now, she will be the kingdom's rock. Now... she is--","0","0","1","70","12093","0","112095","0","0","0","0","0","0"
"157607","","A liar!","0","0","1","70","971","0","111802","0","0","0","0","0","0"
"157608","","So, this was your play all along. Despicable.","0","0","1","70","4346","0","111803","0","0","0","0","0","0"
"157609","","What is the meaning of this, girl?!","0","0","1","70","2505","0","111408","0","0","0","0","0","0"
"157611","","Lady Priscilla Ashvane, you are under arrest for trafficking, conspiring with pirates, and high treason against the Admiralty of Kul Tiras.","0","0","1","70","9873","0","111804","0","0","0","0","0","0"
"157612","","Your company MADE the weapons that destroyed Daelin's Gate using this!","0","0","1","70","5541","0","111805","0","0","0","0","0","0"
"157613","","It's called Azerite... and the Alliance and Horde are already at war over it.","0","0","1","70","5805","0","111806","0","0","0","0","0","0"
"157614","","You hired the pirate fleet, armed them to the teeth, and set them upon your own countrymen.","0","0","1","70","6484","0","111807","0","0","0","0","0","0"
"157616","","And I almost... Priscilla... How could you betray the kingdom? How could you betray me?","0","0","1","70","8433","0","112096","0","0","0","0","0","0"
"157617","","You're too weak to rule, Katherine.","0","0","1","70","3165","0","111409","0","0","0","0","0","0"
"157621","It's over, Stormsong! Look around you... You're surrounded!","","0","0","1","70","6480","111383","0","0","0","0","0","0","0"
"157622","All I see are lost souls, crying for release.","","0","0","1","70","5800","111384","0","0","0","0","0","0","0"
"157623","You brought your end with you, Pike. I must deliver the fleet to our glorious savior... Azshara.","","0","0","1","70","9000","111385","0","0","0","0","0","0","0"
"157624","STORMSONG!","","0","0","1","70","0","111386","0","0","0","0","0","0","0"
"157625","","Sam, no!","0","0","1","70","0","0","111376","0","0","0","0","0","0"
"157626","","Dis ends here, General. De plots. De lies. De murders.","0","0","1","70","13230","0","111377","0","0","0","0","0","0"
"157637","<Jakra'zet groans.>","","0","0","1","70","0","111379","0","0","0","0","0","0","0"
"157642","","Give him a clean death. We have seen enough suffering for one day.","0","0","1","70","5702","0","111378","0","0","0","0","0","0"
"157645","Suffering? You have not seen true suffering. Not yet...","","0","0","1","70","11539","111380","0","0","0","0","0","0","0"
"157646","But you will!","","0","0","1","70","0","111381","0","0","0","0","0","0","0"
"157647","No... It cannot be!","","0","0","1","70","0","111387","0","0","0","0","0","0","0"
"157648","","He was de final sacrifice... We have failed.","0","0","1","70","0","0","111388","0","0","0","0","0","0"
"157750","Prepare to face my unbeatable team of highly modified and customized robots!","","0","0","0","64","0","0","0","0","0","0","0","0","0"
"157751","No pet can compete with my team, I'm unstoppable!","","0","0","0","64","0","0","0","0","0","0","0","0","0"
"157752","Inconceivable! Next time I'm building bigger robots.","","0","0","0","64","0","0","0","0","0","0","0","0","0"
"157755","My brilliant mind making even more brilliant machines is an unbeatable combination.","","0","0","0","64","0","0","0","0","0","0","0","0","0"
"157756","Malfunction!? That's not supposed to happen!","","0","0","0","64","0","0","0","0","0","0","0","0","0"
"157762","","I dunnae know who that is, but I'm sure she needs killin'!","0","0","0","68","0","0","112284","0","0","0","0","0","0"
"157956","Hey there, name's Dilbert McClint, Infestation Management.  Always nice to battle a fellow arachnoid enthusiast.","","0","0","0","64","0","0","0","0","0","0","0","0","0"
"157958","Yeah, that's right.  We're bad! Rock and Roll!","","0","0","0","64","0","0","0","0","0","0","0","0","0"
"157961","When one falls, another takes its place!","","0","0","0","64","0","0","0","0","0","0","0","0","0"
"157962","One guy, three spiders, 26 total legs, you didn't have a chance.","","0","0","0","64","0","0","0","0","0","0","0","0","0"
"157963","Looks like it's time for me to tear out the bad battle spiders and put in some good battle spiders.","","0","0","0","64","0","0","0","0","0","0","0","0","0"
"158025","Show dem, leader of Zandalar. Show da blade to those dat need to see it da most. Give dem peace.","","0","0","0","70","0","112354","0","0","0","0","0","0","0"
"158027","Ya brought de champion to dese shores against ya father's will. Ya learned da secrets of G'huun when no one be listenin'.","","0","0","0","70","0","112355","0","0","0","0","0","0","0"
"158028","Ya set in motion what be needed ta save ya people. Now, more than ever, dey be callin' for a leader dey can love and trust.","","0","0","0","70","0","112356","0","0","0","0","0","0","0"
"158029","Show dem da blade. Become da symbol dey need.","","0","0","0","70","0","112357","0","0","0","0","0","0","0"
"158031","","Dis was not my achievement.","0","0","0","70","0","0","112316","0","0","0","0","0","0"
"158033","","Behold de blood of G'huun. By his will were borne de deaths of Shadra, Hi'reek, Torga, and ...and Rezan.","0","0","0","70","0","0","112317","0","0","0","0","0","0"
"158034","","By his will were borne de deaths of so many of our brothers and sisters.","0","0","0","70","0","0","112318","0","0","0","0","0","0"
"158035","","Let dis glaive be displayed as a reminder dat no matter how far we fall, no matter how much we lose, we are Zandalari!$bWe adapt, we find a way to survive!","0","0","0","70","0","0","112319","0","0","0","0","0","0"
"158036","","If it were not for dis hero of de Horde, our losses would have been far worse.$bDis proves, more than ever, dat it is time for us to adapt, to become part of de world again.","0","0","0","70","0","0","112320","0","0","0","0","0","0"
"158037","","Zandalar forever!","0","0","0","70","0","0","112321","0","0","0","0","0","0"
"158093","Brothers and sisters! The Horde is pressing further into Darkshore! Rally at the Wildbend River.","","0","0","6","70","0","112410","0","0","0","0","0","0","0"
"158273","","We are getting out of here!","0","0","0","70","0","0","112567","0","0","0","0","0","0"
"158529","Sylvanas! Your foul deeds desecrate this sacred place! Andu-falah-dor!","","0","0","0","70","0","113280","0","0","0","0","0","0","0"
"158530","","Malfurion. How gracious of you to join us...","0","0","1","70","0","0","113734","0","0","0","0","0","0"
"158531","","Who would have guessed that you would come to protect your precious trees?","0","0","0","70","0","0","113735","0","0","0","0","0","0"
"158532","Begone, witch!","","0","0","0","70","0","113281","0","0","0","0","0","0","0"
"158533","","Argh! My eyes! It burns!","0","0","0","70","0","0","113736","0","0","0","0","0","0"
"158534","","Where did you fly away to, little bird?","0","0","0","70","0","0","113737","0","0","0","0","0","0"
"158971","Mrglrglrgl!","Mrglrglrgl!","0","0","0","64","0","0","0","0","0","0","0","0","0"
"158972","Mrgl? Rgl!","Mrgl? Rgl!","0","0","0","64","0","0","0","0","0","0","0","0","0"
"158973","Mrg? Grml?!","Mrg? Grml?!","0","0","0","64","0","0","0","0","0","0","0","0","0"
"158975","Rgrml grml grml!","Rgrml grml grml!","0","0","0","64","0","0","0","0","0","0","0","0","0"
"158976","Mrglrgl? Mrg! Rgl!","Mrglrgl? Mrg! Rgl!","0","0","0","64","0","0","0","0","0","0","0","0","0"
"158977","Mrrrmgrl!","Mrrrmgrl!","0","0","0","64","0","0","0","0","0","0","0","0","0"
"158978","Rgl... mrg...","Rgl... mrg...","0","0","0","64","0","0","0","0","0","0","0","0","0"
"158979","Mrg!","Mrg!","0","0","0","64","0","0","0","0","0","0","0","0","0"
"158980","Grgl...","Grgl...","0","0","0","64","0","0","0","0","0","0","0","0","0"
"158981","Rgll mgrgl... rgl...","Rgll mgrgl... rgl...","0","0","0","64","0","0","0","0","0","0","0","0","0"
"158982","Mrrg mrgl?","Mrrg mrgl?","0","0","0","64","0","0","0","0","0","0","0","0","0"
"158983","Mrglrggg...","Mrglrggg...","0","0","0","64","0","0","0","0","0","0","0","0","0"
"159475","","Katherine Proudmoore has spent her life doing what's best for Kul Tiras!","0","0","1","70","5519","0","113400","0","0","0","0","0","0"
"159476","","My dear friend Priscilla and I have discussed this. I believe that what is best for Kul Tiras is that I step down as Lord Admiral...","0","0","1","70","11392","0","113401","0","0","0","0","0","0"
"159479","","I will shoulder this heavy burden. I can only hope I will be a worthy successor.","0","0","1","70","7542","0","113404","0","0","0","0","0","0"
"159480","","And we have evidence!","0","0","1","70","1947","0","113405","0","0","0","0","0","0"
"159481","","Your family has always been too weak.","0","0","1","70","4303","0","113406","0","0","0","0","0","0"
"159482","","The Proudmoore legacy of failure dies with you!","0","0","1","70","5020","0","113407","0","0","0","0","0","0"
"160012","","OUTRIGGERS! OPEN FIRE!","0","0","0","70","3180","0","114024","0","0","0","0","0","0"
"160294","","Look! They're withdrawing!","0","0","0","70","0","0","114175","0","0","0","0","0","0"
"160405","","You think your pets have a chance against my Azerite infused team? You wish!","0","0","0","64","0","0","0","0","0","0","0","0","0"
"160406","","Can't say I'm surprised, my team is clearly the best.","0","0","0","64","0","0","0","0","0","0","0","0","0"
"160407","","But my pets are infused with Azerite! It's what pets crave!","0","0","0","64","0","0","0","0","0","0","0","0","0"
"160408","","Score one for team Fizzie!","0","0","0","64","0","0","0","0","0","0","0","0","0"
"160409","","That was my least favorite of the bunch, time to play with the real hard hitters, get ready!","0","0","0","64","0","0","0","0","0","0","0","0","0"
"160410","Just remember as we start this battle, you asked for this.","","0","0","0","64","0","0","0","0","0","0","0","0","0"
"160411","Bees are clearly superior. This proves it.","","0","0","0","64","0","0","0","0","0","0","0","0","0"
"160412","Not my bees! No!","","0","0","0","64","0","0","0","0","0","0","0","0","0"
"160413","Score one for the bees!","","0","0","0","64","0","0","0","0","0","0","0","0","0"
"160414","Every time I train up new bees, it's always the same thing. They get big and strong and seemingly unbeatable, and then they sting something and die.","","0","0","0","64","0","0","0","0","0","0","0","0","0"
"160415","","I've found the toughest sea creatures around to battle for me, you don't stand a chance.","0","0","0","64","0","0","0","0","0","0","0","0","0"
"160416","","Never a doubt in my mind.","0","0","0","64","0","0","0","0","0","0","0","0","0"
"160417","","Always more fish in the ocean, right?  Maybe that's not what that saying means now that I think about it.","0","0","0","64","0","0","0","0","0","0","0","0","0"
"160418","","Looks like that one now sleeps with the fishes!","0","0","0","64","0","0","0","0","0","0","0","0","0"
"160419","","You're better suited to be chum on a fishing boat than battling for my team.","0","0","0","64","0","0","0","0","0","0","0","0","0"
"160420","","Strange creatures on this island will make for a strange battle I suspect.","0","0","0","64","0","0","0","0","0","0","0","0","0"
"160421","","You need much more training before you can handle a master like myself.","0","0","0","64","0","0","0","0","0","0","0","0","0"
"160422","","This was not supposed to happen, the prophecy spoke otherwise.","0","0","0","64","0","0","0","0","0","0","0","0","0"
"160423","","Return to where you came from!","0","0","0","64","0","0","0","0","0","0","0","0","0"
"160424","","Your determination is admirable, but the outcome of this has already been determined.","0","0","0","64","0","0","0","0","0","0","0","0","0"
"160425","If you want to beat the likes of me you're going to need a bigger boat to haul these out of here.","","0","0","0","64","0","0","0","0","0","0","0","0","0"
"160426","One person against one shark, maybe an even fight.  One person against three? You're insane.","","0","0","0","64","0","0","0","0","0","0","0","0","0"
"160427","Big deal you beat me. I'm still stuck down here for eternity. At least I had a conversation today.","","0","0","0","64","0","0","0","0","0","0","0","0","0"
"160428","Feeding time, boys!","","0","0","0","64","0","0","0","0","0","0","0","0","0"
"160429","The smell of blood in the water will just attract more sharks.","","0","0","0","64","0","0","0","0","0","0","0","0","0"
"160430","","Before we start, I just want to remind you to not feel too bad when my team annihilates yours.","0","0","0","64","0","0","0","0","0","0","0","0","0"
"160431","","Like I said in the beginning, my team is clearly superior.","0","0","0","64","0","0","0","0","0","0","0","0","0"
"160432","","Well this is most unexpected. You can bet I will be ready to win the next time we meet.","0","0","0","64","0","0","0","0","0","0","0","0","0"
"160433","","Annihilated!","0","0","0","64","0","0","0","0","0","0","0","0","0"
"160434","","Unexpected.","0","0","0","64","0","0","0","0","0","0","0","0","0"
"160435","These little guys are pretty strange, but they sure pack a punch. Are you sure you want this fight?","","0","0","0","64","0","0","0","0","0","0","0","0","0"
"160436","They have a lot of sharp pointy things and look mean, and you thought you could win?","","0","0","0","64","0","0","0","0","0","0","0","0","0"
"160437","I should diversify my roster of pets now that I think about it.  Three of the same kind of pet, what was I thinking?","","0","0","0","64","0","0","0","0","0","0","0","0","0"
"160438","Burly's Pet Battle Training Center.  I like the sound of that, and now I'm one step closer to beating you!","","0","0","0","64","0","0","0","0","0","0","0","0","0"
"160439","This is not the way this is supposed to be going. I'm supposed to be winning!","","0","0","0","64","0","0","0","0","0","0","0","0","0"
"160529","","We did it...  We actually did it!","0","0","0","70","0","0","114176","0","0","0","0","0","0"
