Id,Name,Description,Cooldown,Duration,Flags,SpellSchoolMask,IconFileDataId
"198","Bone Shield","Rattlebag encases himself in whirling bones, reducing damage taken by $s1 and inflicting $s2 Shadow damage to enemies that strike him.","3","2","0","32","136127"
"199","Lumbering swing","A wild swing that strikes all enemies in melee, dealing $s1 damage.","3","0","0","1","236316"
"200","Stunning Swipe","Lashes out dealing $s1 nature damage to all enemies in melee, and decreasing their damage by $s2","4","0","0","8","132105"
"201","Monstrous Rage","Fies into a frenzy, assaulting all enemies at range, dealing $s1 nature damage.","4","0","0","8","136217"
"202","Whirling Wall","Attracts the attention of all enemies, focusing their attention on itself.","4","2","0","8","136018"
"203","Bitting Winds","Deadly winds of anima infused magic tear through all enemies in melee, dealing $s1 Nature damage.","4","0","0","8","136022"
"204","Death Blast","Blasts the closest enemy with $s1 shadow damage, reducing their damage by $s2 for two turns","5","2","0","32","460686"
"205","Bone Dust","Necromantic energy pulses forth, healing front line allies for$s1","3","0","0","8","132097"
"206","Abominable Kick","Is it a foot? Is it a hoof? Hard to tell, but it hits hard, dealing $s1 damage to the closest enemy.","3","0","0","1","132368"
"207","Feral Lunge","Lunges into their foes with tooth and claw, dealing $s1 damage to all enemies in a line.","2","0","0","1","132133"
"208","Intimidating Roar","Roars out a spine chilling challenge to a random enemy, focusing their attention on itself.","4","2","0","8","132137"
"209","Ritual Fervor","Inspires a random ally to greater sacrifice. Buffing their damage by $s1 for one turn","2","1","0","32","3528291"
"210","Waves of Death","Emits a wave of death magic, dealing $s1 Shadow damage to all enemies.","3","0","0","32","451165"
"211","Acidic Ejection","Spits out a stream of toxic material, dealing $s1 Nature damage in a cone emitting from the closest enemy.","4","0","0","8","136016"
"212","Panic Attack","The paniced beast strikes out at a random target, dealing $s1 damage.","4","0","0","1","136147"
"213","Heal the Flock","The ancient creature emits waves of beneficial spores, healing in a cone from the closest ally for $s1","3","0","0","8","628135"
"214","Necrotic Lash","Lashes out with necrotic energy in a cone from the closest enemy, dealing $s1 shadow damage.","2","0","0","32","3528297"
"215","Slime Fist","Strikes out with massive fists, dealing $s1 Nature damage to the closest enemy.","5","0","0","8","840404"
"216","Threatening Hiss","Hisses loudly. Stay away! Prevents itself from being a target for two turns","5","2","0","32","132103"
"217","Massacre","Lashes out with Necrotic energy, assaulting all enemies at range, dealing $s1 shadow damage.","4","0","0","32","3528295"
"218","Ritual of Bone","Spins a protective sheath of bone. Mitigating damage taken by $s1 for two turns.","5","2","0","32","458717"
"219","Necrotic Healing","Draws upon death to empower their necrotic energy, healing the closest ally for $s1, and decreases their damage taken by $s2 for two turns.","6","2","0","32","3528292"
"220","Wild Slice","Deadly claws tear through all enemies in melee, dealing $s1 damage.","3","0","0","1","457637"
"221","Burrow","Digs underground, avoiding being targeted for two turns","4","2","0","8","136025"
"222","Poisonous Bite","Strikes with poison laden teeth, dealing $s1 nature damage to the closest enemy, and inflicting #s2 nature damage over two turns.","4","2","0","8","136016"
"223","Wave of Eternal Death","Powerful death magic rolls across the Planes of Torment, causing a stacking damage over time effect to all of your party.","1","10","0","32","136160"
"224","Maw Wrought Slash","Deadly claws tear through all enemies in melee, dealing $s1 damage.","3","0","0","1","132116"
"225","Stream of Anguish","Spews forth a cloud of screams, dealing $s1 Shadow damage in a cone emitting from the closest enemy.","2","0","0","32","236302"
"226","Thrust of the Maw","Lashes out with their spear in a cone from the closest enemy, dealing $s1 shadow damage.","3","0","0","32","3528302"
"227","Bombardment of Dread","The Jailer sends a bombardment of missles across Calcis, dealing $s1 Shadow damage to a random enemy every turn.","1","0","0","32","3528302"
"228","Destruction","After ten turns a wave of absolute destruction flows through the The Tremaculum, dealing $s1 damage to your party.","10","0","1","32","3528305"
"229","Mawsworn Ritual","Ancient rites and runes protect a random member of the enemy team, reducing their damage taken by $s1% for two turns.","2","2","0","32","3528305"
"230","Faith in Domination","The Altar of Domination provides a locus of faith for the Mawsworn, healing them for $s1.","2","1","0","32","3528299"
"231","Mawsworn Strength","Intimidates a random enemy, causing them to take $s1 more damage for two turns.","4","2","0","32","3528299"
"232","Aura of Death","Focuses a feeling of dread upon a random enemy, reducing their damage done by $s1 for three turns.","4","3","0","32","3528300"
"233","Teeth of the Maw","Fires a manifestation of pure doom at the closest enemy, dealing $s1 Shadow Damage.","3","0","0","32","3528298"
"234","Power of Anguish","Inspires their allies through fear, causing them to do $s1 more damage for two turns.","4","2","0","32","3528299"
"235","Vengence of the Mawsworn","Targets enemies at range, calling down missles of pure maw anima, dealing $s1 shadow damage.","3","0","0","32","3528302"
"236","Empowered Minions","Draws upon the maw itself to empower their allies, decreases their damage taken by $s1 for two turns.","4","2","0","32","3528299"
"237","Maw Swoop","Sweeps down with precision, slashing deeply at all enemies in melee, dealing $s1 Shadow Damage.","4","0","0","32","3528301"
"238","Death Shield","Attracts the attention of all enemies for two turns.","4","2","0","8","136051"
"239","Beam of Doom","Fires a manifestation of pure doom at enemies at range, dealing $s1 Shadow Damage.","5","0","0","32","3528298"
"240","Spear of Dread","Surges into the enemy ranks, dealing $s1 Shadow damage to all enemies in a line.","3","0","0","32","135131"
"241","Pain Spike","A spiral of maw anima surges towards a random enemy, dealing $s1 Shadow damage and reducing their damage done by $s2 for two turns","4","2","0","32","3528298"
"242","Dark Healing","Heals the closest ally for $s1, and decreases their damage taken by $s2 for two turns.","4","2","0","32","3528300"
"243","Baleful Stare","Stares into the Abyss, taunting all enemies and reducing their damage taken by $s2 for two turns","5","2","0","32","3528299"
