Id,Text,Text1,LanguageId,ConditionId,EmotesId,Flags,ChatBubbleDurationMs,SoundEntriesId0,SoundEntriesId1,EmoteId0,EmoteId1,EmoteId2,EmoteDelay0,EmoteDelay1,EmoteDelay2
"1","救命啊！我动不了了！","","0","0","0","70","0","0","0","0","0","0","0","0","0"
"3927","自毁系统程序启动。","","0","0","0","69","0","0","0","0","0","0","0","0","0"
"9426","让火焰净化一切吧！","","0","0","0","71","0","8046","0","0","0","0","0","0","0"
"15708","","来，这边走。","7","0","0","68","0","0","44118","0","0","0","0","0","0"
"33630","这远远不够，兽人！下马投降，否则就是死路一条！","这远远不够，兽人！下马投降，否则就是死路一条！","0","8193","0","69","0","0","0","0","0","0","0","0","0"
"33631","","别挡道，蠢货！","0","8193","0","69","0","0","0","0","0","0","0","0","0"
"33996","生命的凋零，不可避免。","","0","0","0","65","0","0","0","0","0","0","0","0","0"
"33997","我必须这么做。","","0","0","0","65","0","0","0","0","0","0","0","0","0"
"34001","你们没有时间了！","","0","0","0","65","0","0","0","0","0","0","0","0","0"
"34012","也许正是这种不完美，才使你们获得了自由的意志，并因此有能力改变那些看起来不可避免的必然命运。泰坦所创造的许多完美生命体都遭遇了失败，而你们仍能继续前行。","","0","0","0","65","0","0","0","0","0","0","0","0","0"
"42407","","去吧，我的纳迦！迎接强大的猎潮者来到艾泽拉斯。","0","0","1","118","0","0","18874","0","0","0","0","0","0"
"42434","你和你那些长鳞的虫子根本不是我的对手……","","0","0","0","118","0","19457","0","0","0","0","0","0","0"
"42435","","蠢货！今天就是你的死期！","0","0","15","118","0","0","18875","0","0","0","0","0","0"
"42518","你们太过火了，毒蛇。你们会为这次入侵付出惨重的代价！","","0","0","0","118","0","19463","0","0","0","0","0","0","0"
"42545","","过来，奴仆们！开始攻击！","0","0","15","118","0","0","18876","0","0","0","0","0","0"
"44211","","现在！放出海怪！","0","0","15","118","0","0","18877","0","0","0","0","0","0"
"44212","啊……","","0","0","0","118","0","19464","0","0","0","0","0","0","0"
"44213","","跟着我，宠物们！耐普图隆的国度终于成了我们的掌中之物！","0","0","15","118","0","0","18878","0","0","0","0","0","0"
"44214","现在怎么办，老朋友？","","0","0","1","118","0","21217","0","0","0","0","0","0","0"
"44215","我们遭受了惨重的失败。","","0","0","396","118","0","19526","0","0","0","0","0","0","0"
"44216","我们世界未来的希望，变得渺茫了。","","0","0","396","118","0","19527","0","0","0","0","0","0","0"
"44217","必须让萨尔知道这一切。","","0","0","396","118","0","19528","0","0","0","0","0","0","0"
"44218","他会指引我们……","","0","0","396","118","0","19529","0","0","0","0","0","0","0"
"44219","埃鲁纳克！不——！","","0","0","1","118","0","21218","0","0","0","0","0","0","0"
"44220","啊！！！","","0","0","396","118","0","19530","0","0","0","0","0","0","0"
"44223","","你是人民真正的英雄，利亚姆。不像其他的贵族，我们将让他们付出代价。","0","0","0","71","0","0","19686","66","0","0","0","0","0"
"44225","好吧，萨满，现在呢？","","0","0","1","118","0","21319","0","0","0","0","0","0","0"
"44226","埃鲁纳克，在你身后！","","0","0","1","118","0","21320","0","0","0","0","0","0","0"
"50471","愿圣光祝福我们先祖的灵魂，他们挑选了我的儿子安息在这片应允的神圣土地上。","","0","0","1","71","0","19713","0","0","0","0","0","0","0"
"50472","他属于这里，这片被吉尔尼斯的英雄和爱国者所环绕的土地。","","0","0","1","71","0","19714","0","0","0","0","0","0","0"
"50473","我们一定会回来的，利亚姆，我向你发誓。","","0","0","66","71","0","19715","0","0","0","0","0","0","0"
"50477","吉尔尼斯会铭记你的勇气，利亚姆。","","0","0","66","71","0","19497","0","0","0","0","0","0","0"
"56129","$n，很抱歉欺骗了你，但这实属无奈之举。","","0","0","0","71","0","28571","0","0","0","0","0","0","0"
"56130","数千年来，我们从未遇见过你这样的人。","","0","13211","0","71","0","28572","0","0","0","0","0","0","0"
"56131","所以我得先探明你的心意，这非常重要。","","0","0","0","71","0","28573","0","0","0","0","0","0","0"
"56154","跟我来，小家伙。我想给你看一样东西。","","0","0","0","71","0","28574","0","0","0","0","0","0","0"
"57715","我们要把这地方炸成个大坑，呵呵。","","0","0","0","71","0","30625","0","5","0","0","0","0","0"
"57899","[NOTE: Many placeholder visuals in this cinematic. Expecting Observatory WMO & charge up visuals.]","","0","0","0","71","0","0","0","0","0","0","0","0","0"
"58170","跑吧跑吧，光板儿！要是被我抓住，我就把你吞进肚子里去！","","0","0","0","71","0","0","0","0","0","0","0","0","0"
"58171","我安度因·乌瑞恩是暴风城的王子。我绝不能死在这里。绝不！","","0","0","0","71","0","27577","0","0","0","0","0","0","0"
"59411","为了潘达利亚！","","0","15760","4","71","0","31905","0","0","0","0","0","0","0"
"60365","","成功了！伤口正在愈合！","0","0","1","69","0","0","27417","0","0","0","0","0","0"
"60627","","我们孤注一掷，但成功了。神真子会好起来的。","0","0","1","69","0","0","27418","0","0","0","0","0","0"
"61462","我们的故事发生在很久很久之前，荒暴无道的皇帝阗在位的时候。","","0","0","0","69","0","0","0","1","0","0","0","0","0"
"61463","这位皇帝需要一些可靠的信使和转运人。","","0","0","0","69","0","0","0","1","0","0","0","0","0"
"61464","他找来了一个古怪的洞穴小生物，并用锦绣谷的力量改造了它。","","0","0","0","69","0","0","0","1","0","0","0","0","0"
"61465","他所创造出来的，就是“土地精”。","","0","0","0","69","0","0","0","1","0","0","0","0","0"
"61470","我们来谈谈力量的本质。我的手里握着一把剑。我问你：是谁支配着力量？","","0","0","0","69","0","30130","0","1","0","0","0","0","0"
"61471","是我，因为我拿着剑！","","0","0","0","69","0","30131","0","1","0","0","0","0","0"
"61495","一个土地精可以负担相当于其本身体重五倍的重物。他们从不流汗，还有着超凡的嗅觉。","","0","0","0","69","0","0","0","1","0","0","0","0","0"
"61496","他们的脑袋比花岗岩还要坚硬。而最奇怪的是，他们好像统统都是亲戚。","","0","0","0","69","0","0","0","1","0","0","0","0","0"
"61497","古代熊猫人英雄们解放了被奴役的土地精。","","0","0","0","69","0","0","0","1","0","0","0","0","0"
"61567","野牛人督军露脸了！来吧，让我们做个了结！","","0","0","0","71","0","29776","0","0","0","0","0","0","0"
"61643","直到今天，他们依然在高耸入云的昆莱山上扮演着商人、信使、向导和送货人的角色。","","0","0","0","69","0","0","0","1","0","0","0","0","0"
"61647","他们是非常迷信的种族，经常以他们最喜爱的护身符——或者叫“幸运符”为名。","","0","0","0","69","0","0","0","1","0","0","0","0","0"
"61649","土地精质疑一切他们闻不到的运气，所以带上一口袋粪去见陌生的土地精是个不错的选择。","","0","0","0","69","0","0","0","1","0","0","0","0","0"
"61650","真是个奇怪的种族。","","0","0","0","69","0","0","0","1","0","0","0","0","0"
"61798","几千年前，魔古族掌握着所有的力量，他们残暴地统治着这片土地。但是随着帝国的不断发展壮大，他们需要维持秩序并加以控制。","","0","0","0","69","0","30132","0","1","0","0","0","0","0"
"61799","他们利用山谷的力量以及他们独有的血肉塑造魔法，将一种凶猛的蜥蜴改造成了具有生命的武器。他们打造了一支军队，一支蜥蜴人大军。这是一群嗜血的怪兽，他们的作用就是巩固皇权。","","0","0","0","69","0","30133","0","1","0","0","0","0","0"
"61800","呃，但是创造一种有生命的武器会出现一个问题，你知道吗？","","0","0","0","69","0","30134","0","1","0","0","0","0","0"
"61801","现在是谁在支配着力量？","","0","0","0","69","0","30135","0","1","0","0","0","0","0"
"61802","凶残的蜥蜴人虽然头脑并不发达，但还是很快意识到他们的真实处境。它们先残杀魔古的敌人。","","0","0","0","69","0","30136","0","1","0","0","0","0","0"
"61803","接着，他们屠戮魔古的臣民。","","0","0","0","69","0","30137","0","1","0","0","0","0","0"
"61804","很快，他们便开始残杀魔古。","","0","0","0","69","0","30138","0","1","0","0","0","0","0"
"61805","于是魔古皇帝下令铲除蜥蜴人。他想将整个蜥蜴人种族铲除，却无济于事。他们至今仍在潘达利亚肆虐。","","0","0","0","69","0","30139","0","1","0","0","0","0","0"
"61806","明白了吧——力量得来容易，却不可轻易给予。","","0","0","0","69","0","30140","0","1","0","0","0","0","0"
"61828","","我们就等你了。","0","0","396","69","0","0","31373","0","0","0","0","0","0"
"61979","","来，$p，我指给你看。","0","0","66","70","0","0","31359","0","0","0","0","0","0"
"61980","","透过望远镜看。","0","0","396","71","0","0","31360","0","0","0","0","0","0"
"61981","","恨之煞就在那个螳螂妖建筑里……我猜想它是被一个强大的寄主吸引过去的。","0","0","396","70","0","0","31361","0","0","0","0","0","0"
"61982","","要想进去，得从这儿的螳螂妖头领身上找到经过特殊转化的水晶。","0","0","396","70","0","0","31362","0","0","0","0","0","0"
"61983","","那些头领在这儿……","0","0","396","70","0","0","31363","0","0","0","0","0","0"
"61984","","这儿……","0","0","396","70","0","0","31364","0","0","0","0","0","0"
"61985","","还有这儿。","0","0","396","70","0","0","31365","0","0","0","0","0","0"
"61986","","杀掉他们，夺取水晶。就这么简单。","0","0","396","70","0","0","31366","0","0","0","0","0","0"
"62624","啊，你好，陌生人！洄梦仙酒味道如何？酒不醉人人自醉，雾里看花花非花。半梦半醒，谁是谁非？","","0","0","1","71","0","31784","0","0","0","0","0","0","0"
"62776","什么……？","","0","0","0","71","0","32476","0","0","0","0","0","0","0"
"62777","那是什么声音？","","0","0","0","71","0","32477","0","0","0","0","0","0","0"
"62778","是从……墙那边传来的。","","0","0","0","71","0","32475","0","0","0","0","0","0","0"
"62779","我知道是从哪儿传来的，可那到底是什么？","","0","0","0","71","0","32478","0","0","0","0","0","0","0"
"62781","不……不……","","0","0","0","71","0","32479","0","0","0","0","0","0","0"
"62782","弟兄们！拿起武器！","","0","0","0","71","0","0","0","0","0","0","0","0","0"
"62783","你们三个！去前面协助橡盾队长！","","0","0","0","71","0","32480","0","0","0","0","0","0","0"
"62784","绿耕！黑土！掩护我们的左侧！我可不想遭到偷袭！","","0","0","0","71","0","32481","0","0","0","0","0","0","0"
"62785","莱文，你去右侧！靠你自己了！","","0","0","0","71","0","32482","0","0","0","0","0","0","0"
"62786","其他人！如果你们拿得动武器，就去保护村庄！别让他们越过防线！你们……","","0","0","0","71","0","32483","0","0","0","0","0","0","0"
"62789","我们毫无机会……","","0","0","0","71","0","32485","0","0","0","0","0","0","0"
"62790","所有人，退后！退……","","0","0","0","71","0","32486","0","0","0","0","0","0","0"
"62791","啊啊啊！","","0","0","0","71","0","29747","0","0","0","0","0","0","0"
"62792","你是谁？","","0","0","0","71","0","32487","0","0","0","0","0","0","0"
"62794","何必管我们是谁？我们是来帮你的。","","0","0","0","71","0","29748","0","0","0","0","0","0","0"
"62795","嘿！给我一把干草叉！","","0","0","0","71","0","32504","0","0","0","0","0","0","0"
"62796","你投降了？为什么？因为这群入侵者能摧毁一道长城？别忘了你还有另一道长城…是由那些管这里叫做家的人…比肩铸成的。","","0","0","0","71","0","29749","0","0","0","0","0","0","0"
"62797","别忘了你还有另一道长城…是由那些管这里叫做家的人…比肩铸成的。","","0","0","0","71","0","0","0","0","0","0","0","0","0"
"62798","我们任何人都甘愿放弃生命，以守护这片土地。","","0","0","0","71","0","29750","0","0","0","0","0","0","0"
"62799","这片土地属于我们……","","0","0","0","71","0","0","0","0","0","0","0","0","0"
"62800","属于我们的祖先……","","0","0","0","71","0","0","0","0","0","0","0","0","0"
"62801","属于我们的子孙。","","0","0","0","71","0","0","0","0","0","0","0","0","0"
"62802","这决不会被改变。","","0","0","0","71","0","0","0","0","0","0","0","0","0"
"63378","太迟了！雷电之王将会崛起，从你手上夺取这片土地。","","0","0","0","71","0","0","0","0","0","0","0","0","0"
"63387","他们是怎么发现我们的？拿起武器——我们必须冲出这条峡谷！","","0","0","0","71","0","25871","0","6","0","0","0","0","0"
"63691","噢……我好像把剑弄丢了。","","0","0","0","69","0","30141","0","0","0","0","0","0","0"
"63692","当分裂之力将艾泽拉斯大陆撕扯开来时，我们熊猫人以为世界其它地区都遭到了彻底毁灭。","","0","0","0","69","0","30114","0","0","0","0","0","0","0"
"63693","然而在几个世纪之后，有位名叫刘浪的年轻探险家决定出去看看。他开始了对世界的探索……而他骑的竟是一只海龟！","","0","0","0","69","0","30115","0","0","0","0","0","0","0"
"63694","我们用雕像和歌谣赞美他的英雄气魄，可如果你在他出海的那天守在岸边——我相信，你会觉得他当时的样子傻得很。","","0","0","0","69","0","30116","0","0","0","0","0","0","0"
"63695","噢，那些熊猫人不遗余力地嘲笑他。可是刘浪比人们想象得要聪明。海龟总能回到自己出生的岸边。于是，尽管迷雾笼罩着我们的土地，刘浪总能安然返家。","","0","0","0","69","0","30117","0","0","0","0","0","0","0"
"63696","他每隔几年便回来——讲述旅途中的奇遇：沙漠中的神秘城市，无边草原上的游牧民族，寒冰之下的伟大帝国，还有黄金镀成的神奇王国。","","0","0","0","69","0","30118","0","0","0","0","0","0","0"
"63697","他每次回来，都有更多的熊猫人响应刘浪的召唤，爬到那日渐拥挤的龟背上，与他同行。他们是勇敢的探险家，是冒险王。","","0","0","0","69","0","30119","0","0","0","0","0","0","0"
"63698","那就是刘浪给我们的启示，朋友。人们总爱嘲笑探险家。他们笑啊，笑啊……等他回来就不笑了。","","0","0","0","69","0","30120","0","0","0","0","0","0","0"
"63699","于无声之处起波澜。比如说，一个宁静的池塘。水面平滑如镜。","","0","0","396","69","0","30150","0","0","0","0","0","0","0"
"63700","直到我丢进一块石子。如此微不足道——但瞬间，涟漪就会袭遍整个水面！","","0","0","396","69","0","30151","0","0","0","0","0","0","0"
"63701","锦鱼人也有着卑微的出身。本来只是一种原始生物，但有幸能生长在谷内含有魔法的池塘附近。","","0","0","0","69","0","30152","0","0","0","0","0","0","0"
"63702","池塘的魔力滋养着他们的心智、壮大着他们的躯体，把他们变成了潘达利亚最伟大的古老生物之一。","","0","0","0","69","0","30153","0","0","0","0","0","0","0"
"63703","锦鱼人中的智者确实非常睿智——他们与河流交流的方式，只有我族的长者才能知晓一二。","","0","0","0","69","0","30154","0","0","0","0","0","0","0"
"63704","在水流的低语声中，他们能听见未来。","","0","0","0","69","0","30155","0","0","0","0","0","0","0"
"63705","锦鱼人水语者们，在潘达利亚历史上的重要事件中，都扮演着核心角色。","","0","0","0","69","0","30156","0","0","0","0","0","0","0"
"63706","他们的真知灼见筑起了帝国，解救了奴隶，还在一万年前艾泽拉斯大分裂来临之前，向末代皇帝发出了警告。","","0","0","0","69","0","30157","0","0","0","0","0","0","0"
"63707","想想看——哪怕是最微弱的声音也能改变世界。下次当你决定掷出石子时，考虑一下吧，朋友。","","0","0","0","69","0","30158","0","0","0","0","0","0","0"
"63708","噢，我的弟子——你想要了解螳螂妖？我提醒你，边境前线上到处都是我原先弟子的坟冢。","","0","0","0","69","0","30166","0","1","1","0","0","500","0"
"63709","螳螂妖是严酷的老师。","","0","0","0","69","0","30167","0","0","0","0","0","0","0"
"63710","螳螂妖世代都汇集大军涌上蟠龙脊。它们杀死许多熊猫人，于是我们加倍奉还。可它们的后代又会卷土重来。为何要如此？","","0","0","0","69","0","30168","0","0","0","0","0","0","0"
"63711","我们熊猫人不知道。","","0","0","0","69","0","30169","0","0","0","0","0","0","0"
"63712","古书上说，螳螂妖一直都在这里。它们甚至比魔古族出现得还要早。它们是哪儿来的？","","0","0","0","69","0","30170","0","1","6","0","0","500","0"
"63713","我们熊猫人不知道。","","0","0","0","69","0","30171","0","6","0","0","0","0","0"
"63714","如果你能和螳螂妖交上朋友，赢取了信任，那他们会告诉你螳螂妖的秘密。可我提醒你：","","0","0","0","69","0","30172","0","0","0","0","0","0","0"
"63715","从来没人和螳螂妖交过朋友。","","0","0","0","69","0","30173","0","0","0","0","0","0","0"
"63716","我们熊猫人只知道——螳螂妖屠杀我们的族人，一代又一代地杀害了无数的熊猫人，它们让我们懂得了生命的价值。人生苦短，稍纵即逝，一不留神……灰飞烟灭。","","0","0","0","69","0","30174","0","0","0","0","0","0","0"
"63717","这就是螳螂妖教会我们的东西。","","0","0","0","69","0","30175","0","0","0","0","0","0","0"
"63718","你在这个世界上最怕什么？你是否能战胜恐惧，还是被恐惧征服？","","0","0","0","69","0","30159","0","0","0","0","0","0","0"
"63719","在世界崩裂之前的古老时代，魔古族皇帝统治着潘达利亚。我们的族人被当成奴隶，而且畏惧不已。","","0","0","0","69","0","30160","0","0","0","0","0","0","0"
"63720","魔古族是痛苦与折磨的高手，还精于使用黑暗魔法和恐怖武器。任何熊猫人、猢狲和锦鱼人都无力与之对抗。恐惧笼罩着熊猫人。","","0","0","0","69","0","30161","0","0","0","0","0","0","0"
"63721","是魔古族建造了蟠龙脊。运气最差的奴隶从事建造和防御工作，充当抵挡螳螂妖的炮灰。我的族人害怕极了。","","0","0","0","69","0","30162","0","0","0","0","0","0","0"
"63722","帝国羽翼渐丰，魔古族窥探谷中的秘密，进行实验。他们用活人的血肉和石头造出了可怕的武器。我的族人惶恐不已。","","0","0","0","69","0","30163","0","0","0","0","0","0","0"
"63723","而狂妄的魔古族万万没想到，最后推翻它们统治的，并非敌人，而是受压迫的民众。没想到会有一天，奴隶会挺身而起……","","0","0","0","69","0","30164","0","0","0","0","0","0","0"
"63724","……并且不再畏惧。","","0","0","0","69","0","30165","0","0","0","0","0","0","0"
"63725","火是最有魔力的元素。它能带来温暖，烹制食物。是它把一座房屋变成了一个家。如果善加利用，火能把钢铁铸成刀剑或犁头。但若放任不管，大火也能烧毁整座城市。","","0","0","0","69","0","30099","0","0","0","0","0","0","0"
"63726","火是变化的工具。","","0","0","0","69","0","30100","0","0","0","0","0","0","0"
"63727","很久以前，一群强健的游牧猎手在世界各处游荡。命运和他们开了个玩笑——在艾泽拉斯大分裂发生时，他们刚好来到潘达利亚。这群游荡者被困在了螳螂高原这片荒芜而危险的土地。","","0","0","0","69","0","30101","0","0","0","0","0","0","0"
"63728","那些高尚的猎手想出了自给自足的办法。其中火是关键。他们从地下掘油，用火来温暖房屋，烧饭做菜，烧灼敌人。他们变得强大起来了。","","0","0","0","69","0","30102","0","0","0","0","0","0","0"
"63729","命运之火熊熊燃烧，野牛人诞生了。他们定居在长城之外，拒绝臣服于除自己之外的任何律法。","","0","0","0","69","0","30103","0","0","0","0","0","0","0"
"63730","命运对野牛人是否不公？这就等于是问火究竟是好还是坏。","","0","0","0","69","0","30104","0","0","0","0","0","0","0"
"63731","命运就像火焰——既能塑造我们，也能毁灭我们。","","0","0","0","69","0","30105","0","0","0","0","0","0","0"
"63732","关键在于，你如何利用它。","","0","0","0","69","0","30106","0","0","0","0","0","0","0"
"63733","啊！你想打听我们最伟大的末代帝王少昊？朋友，我可没时间陪你追溯他一生中的冒险奇遇，可他在万年以前采取的行动，直到今天仍然影响深远。","","0","0","0","69","0","30107","0","0","0","0","0","0","0"
"63734","我们知道，他在翡翠林中荡除了自己的疑虑，在卡桑琅丛林里消除了自己的绝望，在螳螂高原上战胜了自己的恐惧，在昆莱山的巅峰击败了自己的愤怒、仇恨和暴力。","","0","0","0","69","0","30108","0","0","0","0","0","0","0"
"63735","人们为纪念这些圣地而建造了寺院。","","0","0","0","69","0","30109","0","0","0","0","0","0","0"
"63736","但请你想象一下，他归返的那一天，置身于这个山谷中。那一刻，大门为他缓缓开启，我们的皇帝成为了焕发纯净之光的造物——胸中无疑无惧亦无恨……","","0","0","0","69","0","30110","0","0","0","0","0","0","0"
"63737","据说，当时山谷中所有的林木都花开满枝，群芳争艳，一直盛开到今天。","","0","0","0","69","0","30111","0","0","0","0","0","0","0"
"63738","但愿我们所有人都能像圣祖皇帝那样生活。像他那样卸下肩头的重担，和宇宙相生共存。我相信，这就是在他化归大地，使潘达利亚免受灾变侵袭之前……想要传达给我们的。","","0","0","0","69","0","30112","0","0","0","0","0","0","0"
"63739","谢谢你，尊敬的皇帝陛下。","","0","0","0","71","0","30113","0","0","0","0","0","0","0"
"63740","有一天，一位父亲厌倦了幼子的顽劣。“你简直像只猢狲！”父亲斥责道。可那孩子还是我行我素。","","0","0","0","69","0","30142","0","0","0","0","0","0","0"
"63741","为了教训他，父亲把儿子拽到林子里，让他看看猢狲是如何生活的。“你知道猢狲是什么样了吧？你想像它们那样生活吗？”","","0","0","0","69","0","30143","0","0","0","0","0","0","0"
"63742","猢狲很是活泼好动。可那是个短命的种族，很少有猢狲能活过二十岁。它们的领袖也只是十四或十五岁。你十四岁时有多成熟？好好想想吧！","","0","0","0","69","0","30144","0","0","0","0","0","0","0"
"63743","然后，父亲问儿子学到了什么。","","0","0","0","69","0","30145","0","0","0","0","0","0","0"
"63744","儿子答道：“我学到的是，我们终日在那一亩三分地上劳作，可猢狲却把整个世界当成自己的花园。我们以寥落的烛光照明，可猢狲却能尽享漫天星光。我每天都要上学读书，可猢狲却在实践中掌握本领。”","","0","0","0","69","0","30146","0","0","0","0","0","0","0"
"63745","最后儿子总结道，“我还是乐得做只猢狲！”","","0","0","0","69","0","30147","0","0","0","0","0","0","0"
"63746","那么是谁更聪明？是父亲，还是儿子？","","0","0","0","69","0","30148","0","0","0","0","0","0","0"
"63747","这个问题就要让你自己去回答了。","","0","0","0","69","0","30149","0","0","0","0","0","0","0"
"64260","你可以让我加入战斗吗？大多数小女孩讨厌蛇，但我觉得蛇很可爱！","你可以让我加入战斗吗？大多数小女孩讨厌蛇，但我觉得蛇很可爱！","0","0","0","69","0","0","0","6","0","0","0","0","0"
"65087","啊，这不是我最仰慕的刺客大师吗！我一直希望能在潘达利亚找到你呢。","","0","0","1","68","0","29135","0","0","0","0","0","0","0"
"65088","很好。我们谈谈吧。","","0","0","0","68","0","29136","0","0","0","0","0","0","0"
"65089","童福！拿酒来。","","0","0","0","68","0","29137","0","0","0","0","0","0","0"
"65090","我的父亲死亡之翼，曾经想摧毁整个艾泽拉斯。","","0","0","0","68","0","29138","0","0","0","0","0","0","0"
"65091","没错，他是误入歧途，可他却说对了一件事——我们的世界……确实脆弱不堪。","","0","0","0","68","0","29139","0","0","0","0","0","0","0"
"65092","我们是晦暗宇宙中的一点光亮。是飘摇在暴风雨中的烛光。","","0","0","0","68","0","29140","0","0","0","0","0","0","0"
"65093","有时我会想，正是我们这个世界的动荡，逼疯了我的父亲。","","0","0","0","68","0","29141","0","0","0","0","0","0","0"
"65094","啊，谢谢你，童福。","","0","0","0","68","0","29142","0","0","0","0","0","0","0"
"65095","现在，言归正传——我觉得一场末世浩劫正在酝酿。不，我说的不是联盟和部落之间的冲突。","","0","0","0","68","0","29143","0","0","0","0","0","0","0"
"65096","相信我——加尔鲁什·地狱咆哮在塞拉摩的所作所为，跟现在降临于我们脆弱家园的浩劫相比，根本算不了什么。","","0","0","0","68","0","29144","0","0","0","0","0","0","0"
