Id,Text,Text1,LanguageId,ConditionId,EmotesId,Flags,ChatBubbleDurationMs,SoundEntriesId0,SoundEntriesId1,EmoteId0,EmoteId1,EmoteId2,EmoteDelay0,EmoteDelay1,EmoteDelay2
"148083","城市已经沦陷。在塞塔里斯和米斯拉克斯战斗过的地方，什么都没有剩下。我们的神灵献出了生命来保护我们，我们决不能让她白白牺牲。","","0","0","0","68","0","106393","0","0","0","0","0","0","0"
"148084","沃里克、柯泰克和我一起封印了墓穴，希望没有人再次唤醒埋葬的巨兽。我们的邻居过去犯下的错误，我们决不会再重蹈覆辙。","","0","0","0","68","0","106394","0","0","0","0","0","0","0"
"148085","神庙里的流言说，柯泰克渴望攻击巨魔。他们是令人畏惧的种族，不会轻易倒下。我们和平共处了那么久……为什么他想发动一场没有胜算的战争呢？","","0","0","0","68","0","106395","0","0","0","0","0","0","0"
"148086","我必须告知沃里克我的顾虑，但我必须先藏好我的钥匙。我感觉有什么灾难很快就要发生了……","","0","0","0","68","0","106396","0","0","0","0","0","0","0"
"148102","沃里克，如果你收到这条消息，那恐怕一切已经太迟了。柯泰克背叛了我们的人民，计划破坏我们很久之前为坟墓施加的屏障。","","0","0","1","68","0","106397","0","0","0","0","0","0","0"
"148139","PLACEHOLDER SCENE - Reveal of the true power of the blood trolls, a giant corrupted titan monster, huge armies of blood trolls, and Ateena mocking Talanji. Ends with a horde of blood trolls descended upon everyone.","PLACEHOLDER SCENE - Reveal of the true power of the blood trolls, a giant corrupted titan monster, huge armies of blood trolls, and Ateena mocking Talanji. Ends with a horde of blood trolls descended upon everyone.","0","0","0","70","0","0","0","0","0","0","0","0","0"
"148147","够了！","","0","0","53","70","0","106526","0","53","0","0","0","0","0"
"148192","都结束了，希尔瓦娜斯！你四周的洛丹伦城墙马上就会崩塌。","","0","0","0","70","6739","105289","0","0","0","0","0","0","0"
"148193","","你根本不知道自己在跟谁打仗，小国王。一切才刚刚开始！","0","0","0","70","7800","0","109620","0","0","0","0","0","0"
"148194","我这辈子都没见过这种东西……","","0","0","0","70","2800","103035","0","0","0","0","0","0","0"
"148195","能被造出来的就一定能被破坏！吉恩，跟我来！","","0","0","0","70","4000","105290","0","0","0","0","0","0","0"
"148207","","摧毁他们！","0","0","0","70","1964","0","106973","0","0","0","0","0","0"
"148208","快撤！","","0","0","0","70","1862","101083","0","0","0","0","0","0","0"
"148209","","不！不能让他们逃走！","0","0","0","70","2248","0","109648","0","0","0","0","0","0"
"148374","这是第一任守护者的钥匙。他的名字叫做苏尔西斯。他死于柯泰克之手。","","0","0","1","70","0","107541","0","1","0","0","0","0","0"
"148375","很久以前，拆解者米斯拉克斯降临到我们的土地。他所过之处一切尽被屠戮，巨魔和蛇人纷纷倒下。","","0","0","1","70","0","107542","0","1","0","0","0","0","0"
"148376","我们的神灵牺牲了自己，将我们从这只怪物的手下解救出来。她击败了克拉西斯，然而阿图阿曼中心的圆盘却被克拉西斯摧毁。","","0","0","1","70","0","107543","0","1","0","0","0","0","0"
"148377","在亲眼目睹这种毁灭性的力量后，我们深知必须采取行动，防止有谁再度唤醒米斯拉克斯。","","0","0","1","70","0","107544","0","1","0","0","0","0","0"
"148378","尽管苏尔西斯力量强大，但他无法凭一己之力建造屏障。我和柯泰克伸出了援手，与他一起将米斯拉克斯封印在了大金字塔内。","","0","0","1","70","0","107545","0","1","0","0","0","0","0"
"148379","随着版图扩张，柯泰克开始醉心于战争。他计划唤醒克拉西斯，并将其用作武器来征服整个陆地。","","0","0","1","70","0","107546","0","1","0","0","0","0","0"
"148380","柯泰克召集了志趣相投的蛇人，组建了一支军队，屠杀任何阻挡他们的人……第一个倒下的就是苏尔西斯，好在他趁早藏好了钥匙。","","0","0","1","70","0","105358","0","1","0","0","0","0","0"
"148381","我们这些仍然忠于塞塔里斯的则被迫离开家园，四处躲藏。自此以后，我们就开始了与无信者的抗争。","","0","0","1","70","0","107547","0","1","0","0","0","0","0"
"148386","","武器……这正是加卡泽在寻找的！一个克拉西斯……","0","0","1","70","0","0","107414","1","0","0","0","0","0"
"148387","","我们得警告公主。","0","0","1","70","0","0","105909","1","0","0","0","0","0"
"148962","一艘船进入地牢。派克表现出密切的关注，为什么一艘载着村民的船会进入他的教团圣地。","一艘船进入地牢。派克表现出密切的关注，为什么一艘载着村民的船会进入他的教团圣地。","0","0","0","79","0","0","0","0","0","0","0","0","0"
"149031","PLACEHOLDER SCENE - 塔兰吉问是否真的结束了；洛坎说邪恶难除，他怀疑日后还会有这种遭遇。
镜头：塔兰吉和洛坎的特写镜头，接着转至弹坑的不祥镜头。","PLACEHOLDER SCENE - 塔兰吉问是否真的结束了；洛坎说邪恶难除，他怀疑日后还会有这种遭遇。
镜头：塔兰吉和洛坎的特写镜头，接着转至弹坑的不祥镜头。","0","0","0","70","0","0","0","0","0","0","0","0","0"
"149155","","你们的入侵到此为止了！别想打扰长母！","0","0","0","68","0","0","101034","0","0","0","0","0","0"
"149157","","求你了，莱克拉。别这么做！你会害死你自己的！","0","0","603","70","0","0","105906","0","0","0","0","0","0"
"149173","什——什么？！","","0","0","6","70","0","111412","0","0","0","0","0","0","0"
"149211","异教徒！","","0","0","0","70","0","104883","0","0","0","0","0","0","0"
"149212","","你的预言最好别出错。","0","0","0","70","0","0","101067","0","0","0","0","0","0"
"149214","啊，他来了，什么神来着……嗯……","","0","0","0","70","0","106211","0","0","0","0","0","0","0"
"149215","管好你的舌头，叛徒。","","0","0","0","70","4500","104884","0","0","0","0","0","0","0"
"149216","莱赞啊莱赞……","","0","0","0","70","2223","106212","0","0","0","0","0","0","0"
"149217","我不是你的信徒，","","0","0","0","70","0","106213","0","0","0","0","0","0","0"
"149218","神灵的时代……结束了。","","0","0","0","70","0","114204","0","0","0","0","0","0","0"
"149219","鲜血的时刻即将来临。","","0","0","0","70","0","106214","0","0","0","0","0","0","0"
"149221","不！哈布图！","","0","0","0","70","0","109696","0","0","0","0","0","0","0"
"149223","你应该听塔兰吉的话。","","0","0","0","70","0","106207","0","0","0","0","0","0","0"
"149224","你变得越来越僵化，老朋友。你让我们的帝国走向衰败。但是我已经预见到了巨魔帝国的再度崛起。","","0","0","0","70","11316","106208","0","0","0","0","0","0","0"
"149225","我可以向你预言。巨魔帝国将像当初那样统治这个世界。而届时那位王者也会像当初那样登上王座，虽然我和你都活不到那一天了。但是我已经从我的神那里看到了这幅景象……","","0","0","0","70","0","0","0","0","0","0","0","0","0"
"149231","不再和外来者讲条件……也不再和洛阿讨价还价。如今鲜血才是我们的道路……也就是戈霍恩的道路！","","0","0","0","70","10540","106209","0","0","0","0","0","0","0"
"149232","","不追他们吗？","0","0","0","70","2000","0","101066","0","0","0","0","0","0"
"149233","不。他们还会回来找我们的。","","0","0","0","70","5059","106210","0","0","0","0","0","0","0"
"149279","来吧，米斯拉克斯。来吧，拆解者。最后的封印必须被破坏。","","0","0","0","70","0","106195","0","0","0","0","0","0","0"
"149283","现在。解开最终的封印。","","0","0","0","70","0","106384","0","0","0","0","0","0","0"
"149313","别那么心急，等一等。","","0","0","274","70","0","106171","0","0","0","0","0","0","0"
"149314","看啊，大火正在吞噬你们的城市。","","0","0","273","70","0","106172","0","0","0","0","0","0","0"
"149315","你可以尝试干掉我们，这你应该办得到。","","0","0","273","70","0","106173","0","0","0","0","0","0","0"
"149317","","不……这不可能。","0","0","274","70","0","0","109663","0","0","0","0","0","0"
"149318","看起来你的魔法……专精……在这种情况下非常有用，不是吗？","","0","0","273","70","0","106174","0","0","0","0","0","0","0"
"149495","她在杀死自己的部队……","","0","0","0","70","2176","105292","0","0","0","0","0","0","0"
"149527","","贝恩，把他们撤回来！","0","0","0","70","2579","0","106974","0","0","0","0","0","0"
"149768","在你们面前的是伟大的柯泰克，永恒的帝王！","","0","0","0","70","0","107664","0","0","0","0","0","0","0"
"149769","[Ph]别废话了， 我的老朋友。乖乖交出米拉斯克斯牢房的钥匙。你会毁灭了我们所有人的！","","0","0","0","70","0","0","0","0","0","0","0","0","0"
"149770","[PH]不过你说对了一件事。废话到此结束了！","","0","0","0","70","0","0","0","0","0","0","0","0","0"
"149771","[PH]钥匙藏在我的要塞深处，沃里克。你真的以为我会蠢到把它放在身上？","","0","0","0","70","0","0","0","0","0","0","0","0","0"
"149772","[PH]厉害，“老朋友”。但是这个还不足以阻止我！","","0","0","0","70","0","0","0","0","0","0","0","0","0"
"149809","你也一样。你父亲对你把这些生物带到这里的行为十分不满。他命我将你带走。","","0","0","0","70","0","109613","0","0","0","0","0","0","0"
"150262","部落的士兵们！你们受伤的兄弟姐妹还躺在战场上，痛苦呻吟！如果我们抛下自己人，这场胜利就毫无荣誉可言！","","0","0","396","68","0","106290","0","0","0","0","0","0","0"
"150263","","勇士们，把他们杀光！听好了，安度因国王和他的部队不是来这里观光的。他们的目标是消灭我们！不要手下留情，因为他们也不会对你手软！","0","0","396","68","0","0","106980","0","0","0","0","0","0"
"150691","我们必须加快进展，大王有一批不速之客……这可能是个麻烦。","","0","0","1","70","6573","109606","0","0","0","0","0","0","0"
"150692","你做好你分内的事，将军，我也会做好我的。","","0","0","1","70","5684","107662","0","0","0","0","0","0","0"
"150693","入侵者！","","0","0","1","70","0","109607","0","0","0","0","0","0","0"
"150694","你会葬身于这片沙漠。","","0","0","1","70","0","107663","0","0","0","0","0","0","0"
"150695","快，能拿的都拿上。尸体就留给秃鹫吧。","","0","0","1","68","0","0","0","0","0","0","0","0","0"
"150696","","基罗，他们还活着！我们不能把他们丢在这里……","0","0","1","68","0","0","0","0","0","0","0","0","0"
"150771","艾泽拉斯在呼唤你，勇士。这是她送给你的礼物，由艾泽拉斯的精华所生。","","0","0","0","70","0","111028","0","0","0","0","0","0","0"
"150772","我是她的代言人，而你，才是她的勇士。现在她需要你为她而战。","","0","0","0","70","0","111029","0","0","0","0","0","0","0"
"150776","伟大的艾泽拉斯之心！","","0","0","0","102","3200","111030","0","0","0","0","0","0","0"
"150790","部落的士兵们，准备好你们的利刃！今天，我们要进军卡多雷！","","0","0","5","94","0","114213","0","0","0","0","0","0","0"
"151809","这里是赞达拉第一任国王的安息之地。达萨生性固执……但现在他只能听命于我！","","0","0","0","70","0","106137","0","0","0","0","0","0","0"
"152532","",".","0","0","0","78","0","0","0","0","0","0","0","0","0"
"152533","",".","0","0","0","78","0","0","0","0","0","0","0","0","0"
"152534","","虽然我们尽力维持秩序，但犯罪、腐败、海盗劫掠渐渐在库尔提拉斯横行。人们正对海军部失去信心。","0","0","0","78","0","0","110426","0","0","0","0","0","0"
"152535","","现在这里由海军统帅凯瑟琳·普罗德摩尔统治，她同时掌管军队和守卫。","0","0","0","78","0","0","110425","0","0","0","0","0","0"
"152536","","库尔提拉斯由四大家族组成。他们由戴林·普罗德摩尔领导，但随着戴林在塞拉摩战败，同盟也渐渐分崩离析。","0","0","0","78","0","0","110424","0","0","0","0","0","0"
"152608","退下！你们不知道这是谁吗？","","0","0","22","78","0","109551","0","0","0","0","0","0","0"
"152609","但是长官……艾什凡女勋爵下令——","","0","0","396","78","0","110185","0","0","0","0","0","0","0"
"152610","艾什凡女勋爵？你效忠的是艾什凡女勋爵吗？你盾牌上画的是艾什凡女勋爵的徽记吗？","","0","0","1","78","0","109552","0","0","0","0","0","0","0"
"152612","对！你效忠库尔提拉斯！你身上的徽记属于普罗德摩尔！你听命于我。","","0","0","22","78","0","109553","0","0","0","0","0","0","0"
"152613","现在退下，让他们通过。我要和他们在办公室详谈。","","0","0","1","78","0","109554","0","0","0","0","0","0","0"
"152614","不、不，长官。","","0","0","669","78","0","110186","0","0","0","0","0","0","0"
"152615","遵命，长官！","","0","0","66","78","0","110187","0","0","0","0","0","0","0"
"152710","","补丁，趁现在！","0","0","0","70","0","0","103848","0","0","0","0","0","0"
"152777","","越过提拉加德海峡那头，就是维克雷斯和斯托颂家族的领地。","0","0","1","78","0","0","0","0","0","0","0","0","0"
"152778","","位于西边的是德鲁斯瓦，那里群山环绕，出产矿石……我们有些最英勇的战士也来自那里。","0","0","0","78","0","0","110427","0","0","0","0","0","0"
"152787","","在斯托颂谷地的北面，斯托颂家族的海潮贤者为我们的传奇舰队建造船只，施以祝福。","0","0","0","78","0","0","110429","0","0","0","0","0","0"
"152878","","一直以来，维克雷斯家族都是普罗德摩尔的忠实拥护者，但最近的议会上却不见他们的身影，这让流言四起，令人不安。","0","0","0","78","0","0","110428","0","0","0","0","0","0"
"152879","","然而，我们已经有好几个月没有听到舰队的消息了！海潮贤者们都回到了自己的修道院，对寻找失踪船只毫无兴趣。","0","0","0","78","0","0","110430","0","0","0","0","0","0"
"152880","",".","0","0","0","78","0","0","0","0","0","0","0","0","0"
"152882","",".","0","0","0","78","0","0","0","0","0","0","0","0","0"
"152883","嗯……哦，没事。是啤酒。虚惊一场。","","0","0","0","70","4530","106114","0","0","0","0","0","0","0"
"152918","","我们必须将各大家族集结在普罗德摩尔的旗帜之下，找到舰队。否则在战争开始之前，库尔提拉斯就将土崩瓦解。","0","0","0","78","0","0","110431","0","0","0","0","0","0"
"152938","大酋长需要你去执行一项十分重要的任务……绝密的任务。","","0","0","0","70","0","106680","0","0","0","0","0","0","0"
"152939","甚至连我都不知道详细情况。","","0","0","0","70","0","106682","0","0","0","0","0","0","0"
"152940","大酋长召见你了吗？","","0","0","0","70","0","105269","0","0","0","0","0","0","0"
"152941","这与你无关。","","0","0","0","70","0","106683","0","0","0","0","0","0","0"
"152942","要是大酋长总把事情瞒着自己的顾问，我们要如何帮她？","","0","0","0","70","0","105270","0","0","0","0","0","0","0"
"152943","要是这些顾问的忠诚更值得信任，也许我的女王会更开诚布公一点。","","0","0","0","70","0","106684","0","0","0","0","0","0","0"
"152944","她的顾问全都忠心……","","0","0","0","70","0","105271","0","0","0","0","0","0","0"
"152945","……向着部落。","","0","0","0","70","0","105272","0","0","0","0","0","0","0"
"152946","","啊，你来了。我还开始担心了。","0","0","0","70","0","0","106992","0","0","0","0","0","0"
"152947","","我需要一位可以完全信赖的人来为我效劳。","0","0","0","70","0","0","106993","0","0","0","0","0","0"
"152948","","有相当一部分部落成员认为我最近的举措有些……不够谨慎。","0","0","0","70","0","0","106994","0","0","0","0","0","0"
"152949","","然而我十分清楚谨慎的含义。","0","0","0","70","0","0","106995","0","0","0","0","0","0"
"152950","","要想赢得这场战争，部落需要盟友。","0","0","0","70","0","0","106996","0","0","0","0","0","0"
"152951","","小鬼国王拥有一件不属于他的东西。帮我带回来。","0","0","0","70","0","0","106997","0","0","0","0","0","0"
"152952","","你要潜入暴风城，解救一名政治囚犯，这名囚犯将帮助我们，彻底改变战局。","0","0","0","70","0","0","106998","0","0","0","0","0","0"
"152953","","你准备好执行任务了吗？","0","0","0","70","0","0","106999","0","0","0","0","0","0"
"152954","我们不会让您失望的……我的女王。","","0","0","0","70","0","106685","0","0","0","0","0","0","0"
"152955","","噢，我知道你不会。","0","0","0","70","0","0","107000","0","0","0","0","0","0"
"153131","","不，你这傻子，走那边！","0","0","0","70","0","0","106124","0","0","0","0","0","0"
"153132","","稳住方向，舵手。","0","0","0","70","0","0","106122","0","0","0","0","0","0"
"153171","数据已恢复。纳兹米尔的腐化是源自于囚禁于该地中心的上古之神。","","0","0","0","70","0","104758","0","0","0","0","0","0","0"
"153172","","上古之神？！这就是鲜血巨魔来袭的原因吗……","0","0","0","70","0","0","106801","0","0","0","0","0","0"
"153177","有三个用于封印腐化的装置。","","0","0","0","70","0","104759","0","0","0","0","0","0","0"
"153180","","没错，公主！","0","0","0","70","0","0","105665","0","0","0","0","0","0"
"153182","","你错了。你别想再伤害我的人民。你的疯狂行径到此为止了！","0","0","0","70","0","0","106802","0","0","0","0","0","0"
"153201","","护盾！快撑不住了！","0","0","0","70","0","0","103846","0","0","0","0","0","0"
"153202","你们听到公主的话了！开火！","","0","0","0","70","0","105705","0","0","0","0","0","0","0"
"153230","停下！表明你们的来意！","","0","0","0","94","0","111674","0","0","0","0","0","0","0"
"153231","让路！高危囚犯正在通过！","","0","0","0","94","0","111677","0","0","0","0","0","0","0"
"153247","","城市的卫兵还是像以往一样纪律严明。父亲生前很为他们骄傲。","0","0","1","94","0","0","112102","0","0","0","0","0","0"
"153248","","但现在，他们却将我视作罪犯。","0","0","1","94","0","0","112103","0","0","0","0","0","0"
"153250","别让平民靠近！构筑防线！","","0","0","0","94","0","111678","0","0","0","0","0","0","0"
"153256","","妈妈，那位女士是谁？","0","0","1","94","0","0","104804","0","0","0","0","0","0"
"153257","","快，我们回家。马上！","0","0","1","94","0","0","111450","0","0","0","0","0","0"
"153258","","吉安娜女士……真的……是她？","0","0","6","94","0","0","111772","0","0","0","0","0","0"
"153259","是大海的女儿！","","0","0","5","94","0","111451","0","0","0","0","0","0","0"
"153260","叛徒！","叛徒！","0","0","5","94","0","111833","111849","0","0","0","0","0","0"
"153261","凶手！","凶手！","0","0","5","94","0","111834","111850","0","0","0","0","0","0"
"153262","她回来杀我们了！","","0","0","5","94","0","111452","0","0","0","0","0","0","0"
"153263","","我必须承受这一切……","0","0","0","94","0","0","112105","0","0","0","0","0","0"
"153264","","也许这是我罪有应得。","0","0","1","94","0","0","112104","0","0","0","0","0","0"
"153423","","别为几项小罪而惴惴不安。我们有更重要的问题需要解决。","0","0","0","70","0","0","103837","0","0","0","0","0","0"
"153432","叛徒！抓住她！","","0","0","0","70","0","109697","0","0","0","0","0","0","0"
"153583","陛下，部落的目的只是为了盗取我们的海军，令其为他们的亡灵大酋长效命。","","0","0","0","70","0","109608","0","0","0","0","0","0","0"
"153584","","这位勇士突破暴风城的重兵把守，把我和祖尔救了出来。如此英勇的行为应当获得您的表彰，父王。","0","0","0","70","0","0","106895","0","0","0","0","0","0"
"153889","","我早知道鲜血巨魔是个威胁，但是我从没想到……会这样……","0","0","0","70","6060","0","106809","0","0","0","0","0","0"
"153890","","如果那个怪物自由了，那就意味着祖达萨的末日！","0","0","0","70","0","0","106810","0","0","0","0","0","0"
"153891","","现在你看到了！你明白了！戈霍恩会征服世界！","0","0","0","70","10600","0","105673","0","0","0","0","0","0"
"154076","","为了联盟。","0","0","0","94","0","0","112106","0","0","0","0","0","0"
"154114","","继续前进吧。莱克拉没法在这片沙漠中坚持太久。","0","0","1","68","0","0","105907","0","0","0","0","0","0"
"154123","","力量与荣耀。鲜血与雷鸣。","0","0","0","70","5814","0","104721","0","0","0","0","0","0"
"154124","","对他人只是口号……对我们却是真理。","0","0","0","70","4998","0","104722","0","0","0","0","0","0"
"154125","","我们是一支骄傲氏族的最后幸存者。坚韧不拔、无法腐化的……玛格汉！","0","0","0","70","16866","0","104723","0","0","0","0","0","0"
"154149","","加卡泽是个叛徒，但大王不会在没有证据的情况下动手。","0","0","603","70","0","0","107409","0","0","0","0","0","0"
"154150","","你知道我别无选择，卡佳。使命高于一切。","0","0","603","70","0","0","107410","0","0","0","0","0","0"
"154306","让他们通过！","","0","0","0","78","0","110188","0","0","0","0","0","0","0"
"154402","让开！把大炮端出来！","","0","0","0","70","0","105733","0","0","0","0","0","0","0"
"154408","是时候拿工资了。随意射击！","","0","0","0","70","0","105734","0","0","0","0","0","0","0"
"154411","","白痴！戈霍恩是不会失败的！你们的力量无济于事！","0","0","0","70","0","0","105672","0","0","0","0","0","0"
"154700","噢！曲球！曲球！","","0","0","0","68","0","105781","0","0","0","0","0","0","0"
"154701","","曲球！曲球！","0","0","0","68","0","0","104596","0","0","0","0","0","0"
"154769","","塔兰吉公主好心地透露了一个古老传送网络的信息，我们也许可以善加利用。","0","0","0","68","0","0","106331","0","0","0","0","0","0"
"154772","","欧库勒斯，你能不能设置好这里的传送系统。我们需要建立连接部落主城的物资补给线。","0","0","0","68","0","0","106332","0","0","0","0","0","0"
"154774","","勇士，你似乎正在逐渐博得赞达拉巨魔的信任。我得去处理其他事务了，祝你好运。","0","0","0","68","0","0","106333","0","0","0","0","0","0"
"154801","……","","0","0","0","86","0","0","0","0","0","0","0","0","0"
"154805","……","","0","0","0","86","0","0","0","0","0","0","0","0","0"
"154809","……","","0","0","0","86","0","0","0","0","0","0","0","0","0"
"154810","……","","0","0","0","86","0","0","0","0","0","0","0","0","0"
"154811","……","","0","0","0","86","0","0","0","0","0","0","0","0","0"
"154812","……","","0","0","0","86","0","0","0","0","0","0","0","0","0"
"154813","……","","0","0","0","86","0","0","0","0","0","0","0","0","0"
"154814","……","","0","0","0","86","0","0","0","0","0","0","0","0","0"
"154815","……","","0","0","0","86","0","0","0","0","0","0","0","0","0"
"154816","……","","0","0","0","86","0","0","0","0","0","0","0","0","0"
"154940","","还真是顽强！你们很荣幸，能活着目睹我引以为傲的武器。","0","0","1","70","8960","0","107011","0","0","0","0","0","0"
"154944","将士们……住手！","","0","0","0","70","1148","109191","0","0","0","0","0","0","0"
"154945","不！我想要光荣的战死！","","0","0","0","70","6269","106268","0","0","0","0","0","0","0"
"154946","我父亲曾说，瓦罗克·萨鲁法尔代表了部落的荣誉……","","0","0","0","70","5822","109192","0","0","0","0","0","0","0"
"154947","听我说，寻死并无荣耀可言。","","0","0","0","70","4801","109193","0","0","0","0","0","0","0"
"154948","这不由联盟的国王说了算！","","0","0","0","70","4235","106269","0","0","0","0","0","0","0"
"154949","现在就是我说了算。","","0","0","0","70","2235","109194","0","0","0","0","0","0","0"
"154951","把他送到监狱。","","0","0","0","70","0","109195","0","0","0","0","0","0","0"
"154952","等我回来，我们再讨论何为荣誉……以及如何让部落重拾荣誉。","","0","0","0","70","5040","109196","0","0","0","0","0","0","0"
"154953","如果……你回得来的话。","","0","0","0","70","2584","106270","0","0","0","0","0","0","0"
"155422","……","","0","0","0","86","0","0","0","0","0","0","0","0","0"
"155644","","这批火药是从艾什凡铸造厂运来的吗？","0","0","0","68","0","0","0","0","0","0","0","0","0"
"155645","是的，斯通队长。","是的，斯通队长。","0","0","0","68","0","0","0","0","0","0","0","0","0"
"155646","","干得好，现在把它们装上船！这些炸药是严重的安全隐患。","0","0","0","68","0","0","0","0","0","0","0","0","0"
"155647","遵命，队长。","遵命，队长。","0","0","0","68","0","0","0","0","0","0","0","0","0"
"155648","快到了，我们的斥候报告说这座岛上藏有大量的艾泽里特。","","0","0","0","70","0","108533","0","0","0","0","0","0","0"
"155649","但我们不知道这里有没有其他东西。你们最好小心点儿。","","0","0","0","70","0","108534","0","0","0","0","0","0","0"
"155650","放下跳板，我们到了。","","0","0","0","70","0","108535","0","0","0","0","0","0","0"
